subreddit,title,clicked,ups,downs,post_paragraph,likes,number_of_comments,category,score,author_flair_css_class,subreddit_type
Mario,whyyy do the Toads’ lips look like this,False,106,0,,,58,,106,,public
Mario,Happy World Pet Day,False,90,0,,,3,,90,,public
Mario,Mario Brothers Movie Desktop Background,False,5,0,,,0,,5,,public
Mario,Can Chris Pratt do the Mario?,False,86,0,,,9,,86,,public
Mario,A Super Mario Sunshine drawing I made,False,75,0,,,17,,75,,public
Mario,I’m both excited and terrified,False,78,0,,,3,,78,,public
Mario,"A little bomb-omb, by me",False,37,0,,,6,,37,,public
Mario,Princess Peach regrets letting Waluigi introduce Toad to Fortnite.,False,767,0,,,20,,767,,public
Mario,Nintendo World and Illumination’s Mario appear to be designed to tie-in to one another.,False,20,0,,,4,,20,,public
Mario,What do you think Chris Pratt's Mario voice for the film is likely to sound like?,False,13,0,"With two days to go til the trailer, I'm curious as to what people are envisioning.

Personally, I could see him going with a Brooklyn accent since Foreman Spike is in the film, implying they're going back to Mario's roots, even though I personally grew up just hearing Mario's Italian accent.

[View Poll](https://www.reddit.com/poll/xvnp3s)",,6,,13,,public
Mario,So uh… would you say Mario Golf Super Rush was a good game? Would you say it has enough in it to be worth the $60 price tag?,False,3,0,,,3,,3,,public
Mario,"2 days, are you ready?",False,32,0,,,2,,32,zToad,public
Mario,"Aside from Bowser, Bowser Jr. or the Koopalings, who is your favourite Mario villain?",False,194,0,,,197,,194,zToadette,public
Mario,Maaan wtf hit me???,False,39,0,,,7,,39,,public
Mario,Here's my take on the SMB3 Vs. SMW debate...,False,221,0,,,72,,221,zLuigi,public
Mario,Mario Movie Trailer Bingo - Alternate Card,False,680,0,,,63,,680,,public
Mario,Can't wait for when the promotional stuff for the Mario movie comes out with the voice actors posing with the characters like this.,False,188,0,,,11,,188,,public
Mario,Pauline or Peach?,False,4,0,Which do you prefer?,,14,,4,,public
Mario,"In honor of the trailer debuting tomorrow, here’s a Mario movie script I wrote!",False,7,0,"I like to write screenplays. When I started twelve years ago, I decided to practice with a Mario idea I had. I knew I couldn’t sell it because I don’t own the property. But it was fun to write.

The premise is based on the original three Mario games: Donkey Kong, Mario Bros. and Super Mario Bros. In the documentary The King of Kong, I learned that in the arcade DK, Mario never saved Pauline-it went to a kill screen at the end. I figured, from a character standpoint, that’s gotta weigh on a guy. 

So to be clear, this has nothing to do with the movie coming out in April. This is entirely my own story, and I had a blast writing it. I hope it’s fun to read.

[Here it is.](https://drive.google.com/file/d/1-8wxSZRMh7XTnH_4vMjCY-Oc1mOyhMsQ/view?usp=drivesdk)",,9,,7,,public
Mario,Queen Peach. (By @guichibo),False,509,0,,,16,,509,zRosalina,public
Mario,Super Mario Movie Trailer MEGATHREAD,False,386,0,"Want to discuss about the movie trailer? You're on the right place!

Be sure to follow the subreddit rules while commenting there!

You can watch the trailer here: https://www.youtube.com/watch?v=yPpazvJrHm0",,913,,386,,public
Mario,"Karma farming posts get removed, egregious reposts will go straight to ban",False,113,0,"First up, apologies for these out of date rules and their juvenile phrasing, that is on our agenda. That said, this post isn't a new rule - it's an existing one:

Rule 2: If a post has no purpose or is something that is incredibly similar/identical to a recent post, it will be removed.

Shitposts, jokes, memes and stuff in that area will continue to be allowed, put posts asking for upvotes, posts asking for others to repost it, and those knockout tournament things where you just repost the same image the next day but now something's been scribbled out all get removed.

Mario doesn't have deep lore, this is never going to turn into a serious discussion subreddit where we only allow quality indepth content. This subreddit is moderated, though we normally stick to a silent approach, but we'll probably give the sidebar and graphics a clean up in the new year. We will probably look for additional mods in the new year, too - at the moment I'm mostly happy with how we moderate, just not as happy with how quickly we do it.",,7,,113,,public
Mario,Do you think maybe he had no idea what he was getting into?,False,907,0,,,178,,907,,public
Mario,Mario from the Mario movie if he looked more like his design from the games,False,365,0,,,13,,365,,public
Mario,"Seeing as the Mario Bros. are from NYC/NDC in the movie, think the Wario Bros. being in the Mafia would be a fitting origin for them?",False,135,0,,,22,,135,,public
Mario,"The trailer of ""The Super Mario Bros. Movie"", but it's a NES style Sprite Comic",False,127,0,,,11,,127,,public
Mario,I’m not familiar with all the Koopa variants. Is the eyepatch one on the right a recurring character? I think the scared one on the left is a hammer bro.,False,202,0,,,28,,202,,public
Mario,I love this Super Mario RPG artwork. This was originally made by a Twitter account named PaleaRaptor.,False,131,0,,,7,,131,,public
Mario,What would happen if Mario never existed?,False,26,0,,,56,,26,,public
Mario,Epic leap of faith,False,46,0,,,2,,46,,public
Mario,Just a quick sketch of Luigi using his Lighting Powers (Art by me),False,18,0,,,2,,18,,public
Mario,"In case nobody did this already, today is Paper Mario: The Thousand Year Door’s 18th anniversary. What an excellent game.",False,16,0,,,0,,16,,public
Mario,I love tumbrl sometimes,False,58,0,,,1,,58,,public
Mario,One last meme about the Movie Discourse.,False,179,0,,,27,,179,zLuigi,public
Mario,Feels like I can take over the world,False,54,0,,,7,,54,,public
Mario,Who needs Plessie anyway?,False,74,0,,,4,,74,,public
Mario,I forgot how frustrating Super Mario Sunshine is,False,6,0,,,6,,6,,public
Mario,Mario has a special announcement!,False,32,0,,,3,,32,,public
Mario,I Like Cheese too😏😏😏,False,10,0,,,0,,10,,public
Mario,Does anyone else prefer New Super Mario Bros Wii over New Super Mario Bros U or am I the only one?,False,24,0,,,19,,24,,public
Mario,Isn’t his name supposed to be WaLuigi?,False,136,0,,,10,,136,,public
Mario,"Give Chris Pratt a fucking chance, he's not that bad",False,540,0,,,190,,540,,public
Mario,found an old lego mario toy i had,False,10,0,dont mind the missing hands and such i was young by the time i got this. pretty sure this is a mario kart thing since i also found a very broken bike belonging to DK,,1,,10,,public
Mario,My attempt at some Princess Peach Fan art,False,25,0,,,1,,25,,public
Mario,ITS ARRIVED BABY,False,37,0,,,2,,37,zWario,public
Mario,How is Charlie Day's speaking Luigi voice gonna sound?,False,4,0,"

[View Poll](https://www.reddit.com/poll/y1ofxf)",,4,,4,,public
Mario,Luigi's Mansion 3 Coloring Pages - Ghosts for Halloween,False,11,0,,,0,,11,,public
Mario,Does anybody have sny predictions for jokes they’re gonna tell in the mario movie?,False,6,0,"I feel like Mario’s gonnna reference Mario Kart or one of the sports games when he meets bowser, saying something along the lines of “Why can’t we just be buddies and go ride go-karts or play tennis?”",,5,,6,,public
Mario,"PSA to everyone, I'm tired of the discourse",False,911,0,,,88,,911,,public
Mario,GTA San Andreas with Mario sounds,False,22,0,,,1,,22,,public
Mario,What “The Super Mario Bros” movie trailer didn't show us,False,49,0,,,2,,49,,public
Mario,The Wrong Princess? Beta Peach Doodle,False,47,0,,,0,,47,,public
Mario,Ah yes the Koopalings just as I remembered,False,201,0,,,7,,201,,public
Mario,GODDAMN BOWSER!,False,48,0,,,2,,48,,public
Mario,The fact that illumination misspelled goomba,False,105,0,,,14,,105,,public
Mario,Comparison of Mario,False,284,0,,,42,,284,,public
Mario,"Hear me out guys, Will Ferrell would be perfect as King K. Rool for the rumored Donkey Kong film!",False,6,0,,,3,,6,,public
Mario,This just might be true...,False,26,0,,,1,,26,,public
Mario,Star Power,False,33,0,,,5,,33,,public
Mario,Now Launched!✨Video game enamel pins in little pocket homes✨ Back now to get lower Early Bird prices for 1st 48 hours! Link in comments.,False,5,0,,,1,,5,,public
Mario,How do I get over this,False,259,0,,,73,,259,,public
Mario,Super Mario 64 in #picoCAD,False,444,0,,,11,,444,,public
Mario,daisy got some new kicks👟👟👟,False,126,0,,,16,,126,,public
Mario,where did mario go?,False,50,0,,,4,,50,,public
Mario,he's so sad :‚(,False,34,0,,,7,,34,,public
Mario,This should be a Halloween 🎃 picture for Nintendo.,False,64,0,,,2,,64,,public
Mario,we've only heard 1.5 seconds of it give Chris a chance,False,444,0,,,295,,444,,public
Mario,The fact that illumination misspelled goomba,False,27,0,,,4,,27,,public
Mario,Me when Mario movie:,False,116,0,,,5,,116,,public
Mario,Wario vs Kirby Smash Bros Fanart (by me),False,34,0,,,2,,34,,public
Mario,Not again!,False,83,0,,,4,,83,,public
Mario,My guy went from being around the same size as Mario in the games to being smaller than a Koopa Troopa.,False,107,0,,,8,,107,zWaluigi,public
Mario,Worth buying and holding sealed?,False,8,0,Anyone purchased these trading cards and holding them as a collectors/investment piece. How do they stack up on long run against other collectables?,,2,,8,,public
Mario,Voicing Mario in the Super Mario Bros. Movie is an impossible task,False,1,0,,,1,,1,,public
Mario,They are two different scenarios. Why are people trying to compare them?,False,44,0,,,1,,44,,public
Mario,What do you think about shy guy showing up in the Mario movie?,False,6,0,"Shy guy is my favorite Mario universe character and it would be cool to see them

[View Poll](https://www.reddit.com/poll/y0z91q)",,2,,6,,public
Mario,The two types of video game mascots,False,116,0,(Still haven’t “perfected” drawing Mario lmao),,7,,116,,public
Mario,"If there are power ups in the movie, how do you think they will handle them? will Mario just touch a fire flower and gain the power, or he'll have to munch it down to gain their powers?",False,1006,0,,,128,,1006,,public
Mario,Princess Toadstool in my style! (Oba/Offbalance Art),False,27,0,,,15,,27,,public
Mario,Remember the hats that GameStop employees had to promote Mario Maker?,False,34,0,,,2,,34,,public
Mario,"Frog, yes or no (for mario odyssey)",False,24,0,,,5,,24,,public
Mario,Witch Rosalina flying around (art by me),False,5,0,,,0,,5,,public
Mario,Idk why but my brain told me to make this,False,39,0,,,3,,39,,public
Mario,"New Meme Template, have fun",False,12,0,,,1,,12,,public
Mario,"Someone in a thread joked that the Penguin Kingdom formed from the penguins that were thrown off the cliff in Super Mario 64, so I turned a trailer screenshot into a dystopia novel cover.",False,8,0,,,4,,8,,public
Mario,I'm still thinking about the Mario Movie so I remade the Penguin scene but as an RPG to calm down,False,886,0,,,39,,886,,public
Mario,"I understand the disappointment of Charles Martinet not voicing Mario, but people really need to chill about Chris Pratt. Besides, we've only heard 2 lines so far.",False,651,0,,,175,,651,,public
Mario,please leave the sonic fandom out of this mario movie debate? please?,False,186,0,,,25,,186,zToadsworth,public
Mario,Lego SMW fire flower,False,4,0,,,0,,4,,public
Mario,"Also, some of the criticizers could be a little nicer to Chris. You can have an opinion without being mean about it.",False,321,0,,,69,,321,,public
Mario,How do you think Charles Martinet will appear in the movie?,False,6,0,"Which option do you see as likelier?

[View Poll](https://www.reddit.com/poll/y0n0nq)",,3,,6,,public
Mario,"My childhood with both SMGs... finally completed today, 12 years later!",False,9,0,,,1,,9,,public
Mario,Don't pick on Luigi or awnser to daisy,False,58,0,,,7,,58,,public
Mario,"Someone got their hands on a version of the Mario movie poster but with all the characters on the poster removed, and if you look closely where Mario was standing, you can see the Crazy Cap store logo from Super Mario Odyssey!",False,66,0,,,23,,66,zMario-Kart,public
Mario,so... i got the full trailer of the mario movie in spanish as an ad on youtube. so here you go.,False,3,0,,,5,,3,zLuigi,public
Mario,"Might not happen, but I would be screaming so much if it did...",False,208,0,,,33,,208,zWario,public
Mario,Super Mario Bros Movie Sketches - By Jasqreate,False,83,0,,,1,,83,,public
Mario,I was bored,False,193,0,,,11,,193,,public
Mario,To anyone misunderstanding the point of my early post about the Tweet.,False,256,0,,,56,,256,,public
Mario,I know who's gonna stop him,False,37,0,,,2,,37,,public
Mario,"Keegan is Toad, so here's my suggestion for Toadette:",False,56,0,,,16,,56,,public
Mario,I feel bad for Chris Pratt due to how the internet has been treating him these last few days due to his Mario voice.,False,252,0,"Am I the only one who feels bad for Chris Pratt due to how the internet has been treating him ever since his Mario voice was shown? While I do agree that they did a better job with it in other countries, I also noticed that Chris Pratt seemed very excited about this job and there's a lot of memes and stuff about how he did a bad job when it was actually that they picked the wrong person for this job.",,160,,252,,public
Mario,FUN FACT GUYS,False,102,0,,,7,,102,zMario-Kart,public
Mario,I made a thing,False,7,0,,,0,,7,,public
Mario,Not the first time Toad has had teeth.,False,41,0,,,0,,41,Yoshi,public
Mario,I personally think Chris Pratt's Mario voice is perfectly fine.,False,24,0,"You can hear a bit of a Brooklyn accent alongside Pratt's normal voice. In most Mario media where he's from Brooklyn, which seems to be the case with this movie, he also had a Brooklyn accent, and it worked well in those cases. We simply didn't hear much in the teaser to really notice it that easily, considering how pissed off everyone is about the voice, so I think when we get to hear more of his performance as Mario, we'll understand more. It's better than his typical high-pitched and exaggerated Italian accent (which is fine for just a few lines in a game) for a full feature-length movie, and I'm looking forward to see how it turns out in the end.

And the fact of the matter is, if Chris Pratt's voice does end up being the worst part of the movie, that means this movie is gonna be spectacular.",,5,,24,zDry-Bones,public
Mario,Crisp Rat's first day on set,False,13,0,,,0,,13,,public
Mario,"Okay, just in case no one thought of this. Mountains and molehills or something.",False,14,0,,,10,,14,Yoshi,public
Mario,"Just saw the much awaited MaRRRio trailer, looks great ngl",False,40,0,,,1,,40,,public
Mario,"My GF challanged me to make a speed draw of Luigi eating ramens, wyt?",False,32,0,,,6,,32,,public
Mario,mario's new job,False,27,0,,,4,,27,,public
Mario,These Guys must stop,False,3,0,,,0,,3,,public
Mario,"It’s me a Mario fan-art, HELLO!",False,7,0,Just an rough draft of Mario.,,0,,7,,public
Mario,The Super Mario Bros. Movie Experience Intruction Handbook,False,80,0,,,17,,80,zPeach,public
Mario,Is Bowser really a koopa?,False,6,0,"Bowser is the king of the koopas, yet he is clearly very different from every other koopa regarding appearance - which makes sense, he is the big bad guy and should stand out from the rest. It does make you wonder though, is the king of the koopas really a koopa if he that much different from the rest of the koopas?

At first I thought that Bowser started out as a regular koopa - after all he has yellow skin and a green shell on his back like other koopas, so perhaps he simply grew larger and larger while changing more and more. However, he has a son that looks just like him except smaller, indicating that Bowser likely never looked like regular koopa at all.

So what gives? Is there an in-game explanation for this? Is he a mutated koopa? Or is he a rare breed, a one-in a million type of Koopa? Something like Ganon in the legend of Zelda?",,11,,6,,public
Mario,Do you yield?,False,29,0,,,1,,29,,public
Mario,This fan video using audio from one of Anya Taylor Joy's other works confirms for me that she will be a great Princess Peach.,False,6,0,,,1,,6,,public
Mario,"Seriously, some people need to chill.",False,286,0,,,63,,286,zLuigi,public
Mario,This ad came out of nowhere (I already watched the Mario trailer 2 days ago…),False,10,0,,,3,,10,,public
Mario,Who loves/Likes Bowser?,False,13,0,"I mean I’m a fan of some Mario villans. Such as the Koopalings Ect.

Also Bower is being voiced by Jack black in the New Mario film in 2023!",,8,,13,,public
Mario,How Chris Pratt be sounding as Mario.,False,6,0,,,0,,6,,public
Mario,my life is like a daisy,False,3,0,,,2,,3,,public
Mario,The Super Mario Bros Movie trailer but it looks like Mario 64,False,2760,0,,,37,,2760,,public
Mario,"You owe it to yourself. Zoom in on this high res version of the Super Mario Bros Movie poster, and get lost in the level of detail [3158 x 5000]",False,213,0,,,34,,213,,public
Mario,Mario’s design in the movie- is this the new look of Mario? Or is it just for the movie?,False,5,0,"https://i.kym-cdn.com/entries/icons/original/000/038/404/FeaYy4SX0AAwhRr.jpeg

I watched the trailer and I was happily surprised and even relieved with the aesthetic the production went with. It honors the games character designs while adding enough “polish” to make it cinematic. What I did notice is that every other character aside from Mario looks identical to their game counterpart. Only Mario had the most significant change. 

I’m wondering whether this was a decision purely for the movie or are we seeing Mario’s latest design iteration? If you look back in history, Mario has had some significant changes. His most current look began with Mario 64. 

What I find intriguing is his change in head shape and his eye shape. It is reminiscent of his design during his donkey Kong era. I also see some great design references to his look in The Super Mario Brothers Super Show animated segments!

Could this new updated movie design be a way of honoring his history while updating his future game adventures?",,7,,5,,public
Mario,"Mario movie design, before and after.",False,592,0,Tried to make him look more like himself. Is it better or worse? I’m not sure.,,177,,592,,public
Mario,The last thing Luigi sees,False,103,0,,,8,,103,,public
Mario,It's like that.,False,3,0,,,3,,3,,public
Mario,"I painted fanart, I’m excited for the movie! IG Vyntresser",False,27,0,,,2,,27,,public
Mario,[3D MODEL] Princess Peach's Castle,False,7,0,,,2,,7,,public
Mario,Mario Movie Theory: Charles WILL voice Mario (kinda),False,4,0,"Everybody at this point has heard Chris Pratt's voice for *The Super Mario Bros. Movie*. While objectively it's much different than previous incarnations, I'm actually in the camp of those who don't mind the voice. I will not judge the voice entirely until I am in the theater on day one with my full attention. That being said Charles Martinet **is** Mario, and I think Nintendo and Illumination are aware of that. If you watch the trailer, the moment where Mario meets Toad, the voice is silent when he screams. Now it could mean that haven't found the right take from Pratt to insert, but it could be possible that Martinet might be dubbing over his screams. Now, I bet you're thinking that would jarring to hear two different people voicing Mario. And it would be, but this is how I think they will justify it. Seeing how this is an adaptation, the movie has an excuse to add or expand on elements we normally don't see in the games. That element I think they will focus on is Mario and Luigi's parents specifically their father. I believe there will be a sequence in the movie where Mario and Luigi are children talking to their father, who will look and sound exactly like Charles's Mario. When Mario gets older, Luigi will probably make a joke to him about ""having some of their father in him"", which is why Pratt's Mario will occasionally have Martinet coming out of him. I think if this was the case that would be a fun way to still honor Martinet. But it is a theory, so who knows, but regardless I'm pumped for this move. Thoughts?",,4,,4,,public
Mario,Should I get this tattoo?,False,53,0,,,7,,53,,public
Mario,Mario Penguins... but JOJO!,False,24,0,,,0,,24,,public
Mario,"I know Chris Pratt voicing Mario in his regular voice is not good but I think Illumination's trying to make this movie as good as possible, right?",False,112,0,,,43,,112,,public
Mario,Thought I would take advantage of Mario trending to show my custom figure.,False,18,0,,,1,,18,,public
Mario,Mario &amp; Luigi: Superstar Saga fanart!,False,49,0,,,4,,49,,public
Mario,It's always the bad guys,False,406,0,,,24,,406,,public
Mario,The BOWSER™ movie,False,246,0,,,6,,246,,public
Mario,Bowser at Mario when he kidnaps Peach for the 3794th time:,False,161,0,,,2,,161,,public
Mario,How the Mario movie will play out,False,36,0,,,5,,36,,public
Mario,Don't forget Forman Spike is suppost to appear in the movie as well,False,13,0,,,4,,13,,public
Mario,Blursed waluigis taco stand,False,7,0,,,1,,7,,public
Mario,Whos is gonna stop him ?,False,38,0,,,3,,38,,public
Mario,wired mario games,False,3,0,,,1,,3,,public
Mario,Super Nightmare Before Mariomas Bros,False,49,0,I don’t know why… but I made this,,9,,49,,public
Mario,NOW WHO'S GONNA STOP ME,False,70,0,,,3,,70,,public
Mario,"PSA: The Super Mario Bros Movie has EIGHT different release dates, so depending on where you live, you’ll probably want to spend some time away from the internet to avoid spoilers.",False,45,0,,,28,,45,,public
Mario,Double Firepower,False,7,0,,,3,,7,,public
Mario,Most People's Reaction in a Nutshell,False,2814,0,,,272,,2814,,public
Mario,I had a cursed idea,False,66,0,,,2,,66,,public
Mario,Hot take. People are hating on Pratt for mostly sounding like Pratt. But 2/3 of Black's lines in the trailer also mostly just sounded like Black. And neither have the same tone as their Video Game counterparts.,False,39,0,,,55,,39,,public
Mario,The Super Mario Bros. Movie N64 game Tie-in,False,41,0,,,4,,41,,public
Mario,biblically accurate Mario,False,3,0,,,0,,3,,public
Mario,SONIC IN MARIO MOVIE??? (NOT CLICKBAIT) (GONE WRONG) (POLICE CALLED),False,7,0,,,0,,7,,public
Mario,Free vibrators this entire week,False,12,0,,,2,,12,,public
Mario,Chris Pratt Fanart,False,7,0,,,0,,7,,public
Mario,the french dub really is great,False,52,0,,,5,,52,,public
Mario,I felt inspired so I drew the Penguin King.,False,7,0,,,0,,7,,public
Mario,*Laughter* I do not (Have a life),False,28,0,,,2,,28,,public
Mario,I just had to do it!!!,False,18,0,,,0,,18,,public
Mario,Drew bowser and one of the penguins,False,169,0,,,10,,169,,public
Mario,A straight forward title that gets to the point,False,34,0,,,1,,34,,public
Mario,I added Marios voice to the Teaser Trailer,False,10,0,,,1,,10,,public
Mario,The fact both Sonic and Mario have ghosts called boo that look so similar yet so different makes me laugh.,False,6,0,,,1,,6,,public
Mario,Tell me I'm not the only person who thought this.,False,31,0,,,12,,31,,public
Mario,Found this on twitter,False,230,0,,,1,,230,zLuigi,public
Mario,Loving Mario Sunshine,False,6,0,,,2,,6,,public
Mario,I'm gonna fart my Soul for this,False,2,0,I swear if Mario and Luigi's last Names are mentioned in the Movie and if it's just like the Live Action one I'm gonna lose it (which is what I meant from the Title.,,7,,2,,public
Mario,THE SUPER MARIO BROS. MOVIE (2023) - ALL BOSSES &amp; FINAL BOSS + ENDING (Credit in comments),False,222,0,,,21,,222,,public
Mario,I always wondered what Mario would say if he met with a psychologist,False,23,0,,,1,,23,,public
Mario,Bowser Jr. mom?,False,7,0,"Which option would you prefer for juniors mom?

[View Poll](https://www.reddit.com/poll/xyxhxh)",,16,,7,,public
Mario,3 custom lego Mario mini figures I made,False,8,0,,,1,,8,,public
Mario,DO YOU YIELD?,False,1894,0,,,68,,1894,,public
Mario,Toad is a computer expert.,False,371,0,,,8,,371,,public
Mario,Mario Movie Trailer But with mario sounds (not mine by ign),False,7,0,,,6,,7,zLuigi,public
Mario,What character(s) would you like to see make an appearance in the movie?,False,5,0,"Say in the comments if you’d like to see anyone else!

[View Poll](https://www.reddit.com/poll/xz0p82)",,1,,5,,public
Mario,Am I the only one?,False,198,0,,,17,,198,,public
Mario,Crazy animation with this one,False,150,0,,,6,,150,,public
Mario,the game that we're excited about,False,2,0,,,0,,2,,public
Mario,A Super Mario Movie Bowser meme that I made :),False,5,0,,,0,,5,,public
Mario,The next cinematic universe,False,332,0,,,23,,332,,public
Mario,you won't be able to unthink this,False,251,0,,,12,,251,,public
Mario,The Mario movie is number 1 on trending,False,12,0,,,2,,12,,public
Mario,Does He Yield? Meme,False,100,0,,,3,,100,zDry-Bones,public
Mario,credit @mf_abysmal,False,32,0,,,0,,32,zShy-Guy,public
Mario,coincidence,False,45,0,,,4,,45,,public
Mario,Chris Pratt bad apparently,False,372,0,,,136,,372,,public
Mario,It’s a vicious cycle,False,112,0,,,3,,112,zPeach,public
Mario,"""Now who's gonna stop me?!"" (made by me)",False,47,0,,,1,,47,,public
Mario,"Mushroom kingdom, here we come! (doodles made by me)",False,59,0,,,2,,59,,public
Mario,"Calling it now, this is exactly what's gonna happen next trailer.",False,471,0,,,56,,471,zLuigi,public
Mario,"Gotta be honest, even though there are WAY better options out there for the voice of Mario than Chris Pratt, he has grown on me a little bit.",False,141,0,,,27,,141,,public
Mario,[oc] NOW THEY HAVE A MOVIE ✨,False,209,0,,,2,,209,,public
