subreddit,title,clicked,ups,downs,post_paragraph,likes,number_of_comments,category,score,author_flair_css_class,subreddit_type
Mario,Do you think maybe he had no idea what he was getting into?,False,904,0,,,178,,904,,public
Mario,Mario from the Mario movie if he looked more like his design from the games,False,372,0,,,13,,372,,public
Mario,"Seeing as the Mario Bros. are from NYC/NDC in the movie, think the Wario Bros. being in the Mafia would be a fitting origin for them?",False,136,0,,,22,,136,,public
Mario,Who Would You Cast As Waluigi In A Possible Mario Movie Sequel?,False,106,0,,,111,,106,zWaluigi,public
Mario,"The trailer of ""The Super Mario Bros. Movie"", but it's a NES style Sprite Comic",False,132,0,,,11,,132,,public
Mario,I’m not familiar with all the Koopa variants. Is the eyepatch one on the right a recurring character? I think the scared one on the left is a hammer bro.,False,198,0,,,28,,198,,public
Mario,I love this Super Mario RPG artwork. This was originally made by a Twitter account named PaleaRaptor.,False,137,0,,,7,,137,,public
Mario,Mario discovers r34,False,611,0,,,29,,611,,public
Mario,What would happen if Mario never existed?,False,32,0,,,56,,32,,public
Mario,Just a quick sketch of Luigi using his Lighting Powers (Art by me),False,17,0,,,2,,17,,public
Mario,"In case nobody did this already, today is Paper Mario: The Thousand Year Door’s 18th anniversary. What an excellent game.",False,13,0,,,0,,13,,public
Mario,I love tumbrl sometimes,False,56,0,,,1,,56,,public
Mario,One last meme about the Movie Discourse.,False,172,0,,,27,,172,zLuigi,public
Mario,Who needs Plessie anyway?,False,77,0,,,4,,77,,public
Mario,Mario has a special announcement!,False,29,0,,,3,,29,,public
Mario,I Like Cheese too😏😏😏,False,9,0,,,0,,9,,public
Mario,Does anyone else prefer New Super Mario Bros Wii over New Super Mario Bros U or am I the only one?,False,22,0,,,19,,22,,public
Mario,Isn’t his name supposed to be WaLuigi?,False,138,0,,,10,,138,,public
Mario,It's just a movie,False,18,0,,,1,,18,,public
Mario,"Give Chris Pratt a fucking chance, he's not that bad",False,544,0,,,190,,544,,public
Mario,Repost cuz I think this meme is relevant again,False,7,0,,,3,,7,,public
Mario,found an old lego mario toy i had,False,9,0,dont mind the missing hands and such i was young by the time i got this. pretty sure this is a mario kart thing since i also found a very broken bike belonging to DK,,1,,9,,public
Mario,I made an extended version of the poster using AI art,False,12,0,I also added some characters. I guess that’s how DK is gonna look in the movie 😂,,8,,12,,public
Mario,Why has Luigi snapped? (wrong answers only),False,11,0,,,6,,11,,public
Mario,Here's my theory about what Charles Martinet will voice in the Mario movie.,False,43,0,"Since Charles was announced in the casting, and that no one is announced for the voices of Wario and Waluigi, it's Charles who will continue to do the voices of these two characters in the movie.  


Also, maybe Charles will also do some specific voices for Mario and Luigi... For example, if the bros burn themselves in the lava or fall into a pit.   


Do you think this is plausible?",,31,,43,,public
Mario,My attempt at some Princess Peach Fan art,False,26,0,,,1,,26,,public
Mario,ITS ARRIVED BABY,False,39,0,,,2,,39,zWario,public
Mario,Incredible Method Acting: Chris Pratt Paid A Gigantic Turtle To Kidnap His Wife In Order To Prepare For The Role Of Mario,False,23,0,,,3,,23,zBlooper,public
Mario,Luigi's Mansion 3 Coloring Pages - Ghosts for Halloween,False,12,0,,,0,,12,,public
Mario,"PSA to everyone, I'm tired of the discourse",False,909,0,,,88,,909,,public
Mario,GUESS THE MARIO GAME WITH A SINGLE POWER UP,False,17,0,,,10,,17,,public
Mario,The Perfect Mario Couple Kiss😳😳,False,5,0,,,4,,5,,public
Mario,What “The Super Mario Bros” movie trailer didn't show us,False,51,0,,,2,,51,,public
Mario,The Wrong Princess? Beta Peach Doodle,False,43,0,,,0,,43,,public
Mario,Some more doodles I did in class,False,16,0,,,1,,16,,public
Mario,GODDAMN BOWSER!,False,46,0,,,2,,46,,public
Mario,The fact that illumination misspelled goomba,False,108,0,,,14,,108,,public
Mario,With there being rumors that eventually there will be a Donkey Kong spin off film made by Illumination the same company who is also making The Super Mario Bros. Movie who do you think would be the perfect choice to voice King K. Rool if he was confirmed to be the film’s main villain?,False,200,0,,,117,,200,,public
Mario,"Hear me out guys, Will Ferrell would be perfect as King K. Rool for the rumored Donkey Kong film!",False,7,0,,,3,,7,,public
Mario,This just might be true...,False,25,0,,,1,,25,,public
Mario,Star Power,False,35,0,,,5,,35,,public
Mario,Super Mario 64 in #picoCAD,False,447,0,,,11,,447,,public
Mario,daisy got some new kicks👟👟👟,False,123,0,,,16,,123,,public
Mario,so a Mario Movie Speedrun exists...,False,121,0,,,3,,121,,public
Mario,hot take: this is the second best mario kart game ever,False,66,0,,,21,,66,,public
Mario,my attempt of redesigning mario though...,False,126,0,,,8,,126,,public
Mario,where did mario go?,False,51,0,,,4,,51,,public
Mario,he's so sad :‚(,False,39,0,,,7,,39,,public
Mario,we've only heard 1.5 seconds of it give Chris a chance,False,450,0,,,295,,450,,public
Mario,Shy Guy Keycap ‼️,False,35,0,,,0,,35,,public
Mario,Pauline! - {Blender},False,29,0,,,2,,29,zPauline,public
Mario,Me when Mario movie:,False,113,0,,,5,,113,,public
Mario,I guess Miyamoto skipped the spelling lesson.,False,11,0,,,0,,11,,public
Mario,Wario vs Kirby Smash Bros Fanart (by me),False,33,0,,,2,,33,,public
Mario,Not again!,False,80,0,,,4,,80,,public
Mario,My guy went from being around the same size as Mario in the games to being smaller than a Koopa Troopa.,False,105,0,,,8,,105,zWaluigi,public
Mario,Yippy Yo Joe: The Movie,False,18,0,,,0,,18,,public
Mario,Worth buying and holding sealed?,False,9,0,Anyone purchased these trading cards and holding them as a collectors/investment piece. How do they stack up on long run against other collectables?,,2,,9,,public
Mario,What do you think about shy guy showing up in the Mario movie?,False,5,0,"Shy guy is my favorite Mario universe character and it would be cool to see them

[View Poll](https://www.reddit.com/poll/y0z91q)",,2,,5,,public
Mario,The two types of video game mascots,False,119,0,(Still haven’t “perfected” drawing Mario lmao),,7,,119,,public
Mario,"If there are power ups in the movie, how do you think they will handle them? will Mario just touch a fire flower and gain the power, or he'll have to munch it down to gain their powers?",False,1005,0,,,128,,1005,,public
Mario,Princess Toadstool in my style! (Oba/Offbalance Art),False,31,0,,,15,,31,,public
Mario,Remember the hats that GameStop employees had to promote Mario Maker?,False,35,0,,,2,,35,,public
Mario,Witch Rosalina flying around (art by me),False,6,0,,,0,,6,,public
Mario,"Besides the Super Mushroom, Super Star or Fire Flower which powerup do you wanna see in the movie (Please be realistic)",False,41,0,,,92,,41,,public
Mario,I just finished making my nephew birthday present.,False,19,0,"Just like me and his dad, he loves everything Mario. Right now he is obsessed with Luigis Mansion and is going as Luigi for Halloween. I cannot wait to give this to him! I made it 100% from scratch.",,1,,19,,public
Mario,Mario movie 2 has to be a mario galaxy adaptation,False,5,0,Mario in space is just too easy,,7,,5,,public
Mario,Lego SMW Big Mario running,False,12,0,,,3,,12,,public
Mario,"Super Mario 64, But AI Generated",False,22,0,,,3,,22,,public
Mario,"New Meme Template, have fun",False,13,0,,,1,,13,,public
Mario,Reoccurring dreams about SM64DS,False,6,0,I'm hearing more and more people having dreams about Super Mario 64. I thought I was the only one. I usually have dreams about the Nintendo DS version specifically though (I grew up with both). I have a constantly reoccurring dream where you play as Wario or Luigi inside this weird green swamp/sewer level. I also have dreams of the castle hub area being a lot larger as well. Y'all have similar dreams?,,2,,6,,public
Mario,Mario Family Tree,False,7,0,,,41,,7,zPeach,public
Mario,[Easter Egg] The store sign on the Antique's Store in the Super Mario Bros Movie poster might look familiar to the eagle-eyed. As it's written in the original SMB NES Title Screen font,False,31,0,,,4,,31,,public
Mario,Who would've thought the 64 Penguins would've been turned into their own monarchy?,False,274,0,,,42,,274,,public
Mario,"Someone in a thread joked that the Penguin Kingdom formed from the penguins that were thrown off the cliff in Super Mario 64, so I turned a trailer screenshot into a dystopia novel cover.",False,10,0,,,4,,10,,public
Mario,Question about the Mario Movie.,False,5,0,Did everyone expect Mario to have a Brooklyn accent or an Italian accent?,,4,,5,,public
Mario,Kings of Nintendo,False,9,0,,,1,,9,,public
Mario,I'm still thinking about the Mario Movie so I remade the Penguin scene but as an RPG to calm down,False,887,0,,,39,,887,,public
Mario,"I understand the disappointment of Charles Martinet not voicing Mario, but people really need to chill about Chris Pratt. Besides, we've only heard 2 lines so far.",False,661,0,,,175,,661,,public
Mario,please leave the sonic fandom out of this mario movie debate? please?,False,181,0,,,25,,181,zToadsworth,public
Mario,Lego SMW fire flower,False,3,0,,,0,,3,,public
Mario,"So, how much do we think the Mario Movie will make on it's opening weekend?",False,3,0,"Just like The Price is Right, whoever is closest without going over wins.

[View Poll](https://www.reddit.com/poll/y0rgno)",,2,,3,zLuigi,public
Mario,"Also, some of the criticizers could be a little nicer to Chris. You can have an opinion without being mean about it.",False,326,0,,,69,,326,,public
Mario,How do you think Charles Martinet will appear in the movie?,False,4,0,"Which option do you see as likelier?

[View Poll](https://www.reddit.com/poll/y0n0nq)",,3,,4,,public
Mario,"My childhood with both SMGs... finally completed today, 12 years later!",False,10,0,,,1,,10,,public
Mario,mario and rabbids sparks of hope cinematic launch trailer,False,6,0,,,1,,6,,public
Mario,Super Mario 64 Bob Omb Battlefield Painting,False,81,0,,,4,,81,,public
Mario,Don't pick on Luigi or awnser to daisy,False,57,0,,,7,,57,,public
Mario,"Someone got their hands on a version of the Mario movie poster but with all the characters on the poster removed, and if you look closely where Mario was standing, you can see the Crazy Cap store logo from Super Mario Odyssey!",False,62,0,,,23,,62,zMario-Kart,public
Mario,Goombas in the new movie,False,5,0,"I've just realised something interesting, there aren't Goombas on the army of Bowser at the start of the teaser. What if they show them as Mushroom Kingdom citizens at the start and then they rebel like in the Super Mario Bros manual? It feels weird for them not to appear at the start even if only Koopas (and a magikoopa, most likely Kamek) appear since they're like the second most iconic enemy of the franchise, quite tied with Koopas.",,5,,5,Fawful-ML,public
Mario,so... i got the full trailer of the mario movie in spanish as an ad on youtube. so here you go.,False,6,0,,,5,,6,zLuigi,public
Mario,My theories on Charles Martinet’s ”surprise cameos” in The Super Mario Bros. Movie,False,5,0,"As you may know the teaser trailer was released a few days ago and we finally heard Mario’s voice by Chris Pratt. Thus far we don’t know  Martinet’s role in the movie but I’ve been thinking about it: What if he WILL voice Mario? I have two ideas for this:

1. Judging by Mario’s lines heard in the trailer I think this movie will be the origin story, answering how did Mario become Super Mario. The warp pipe from which Mario was flung goes to Brooklyn. Some people have pointed out that Pratt has very subtle accent similar to the ones from the old animated Mario TV shows. Maybe in the beginning Mario sounds ”just like Chris Pratt” but by the end where Mario presumably has the final battle against Bowser, we will hear Mario in the exact same voice as the games.

2. There’s a scene and/or a flashback which shows Baby Mario and Baby Luigi who are voiced by Martinet in the games. Maybe we see how Mario and Luigi grew up right up to their adulthood which could explain Luigi’s scaredy-cat personality seen in Luigi’s Mansion games and Mario’s joyful personality.

What do you guys think?",,2,,5,,public
Mario,Me hearing Chris Pratt’s voice in the trailer for the first time:,False,6,0,,,2,,6,,public
Mario,Super Mario Bros Movie Sketches - By Jasqreate,False,82,0,,,1,,82,,public
Mario,Some Mario kart 8 stickers I’ve put on my shelf,False,14,0,,,0,,14,,public
Mario,How many power-ups do you think nintendo will put in the mario movie?,False,7,0,"How many?

[View Poll](https://www.reddit.com/poll/y0eh6q)",,7,,7,,public
Mario,"Seen a lot of people recreate this scene, so I made my own version using SMB1 sprites!",False,75,0,,,0,,75,,public
Mario,I have no idea what accent kamek has in the Mario movie,False,4,0,Its been bugging me ever since I saw the trailer Idk if it's been officially said what accent it's supposed to be to me it sounds german,,9,,4,,public
Mario,I was bored,False,195,0,,,11,,195,,public
Mario,Mario The Plumber (2023) - New Official Trailer - Universal Pictures,False,8,0,,,3,,8,zDaisy,public
Mario,I am very worried that this will lead to a toxic enviroment of fans thinking they have power over filmmakers.,False,1402,0,,,417,,1402,,public
Mario,To anyone misunderstanding the point of my early post about the Tweet.,False,252,0,,,56,,252,,public
Mario,I know who's gonna stop him,False,40,0,,,2,,40,,public
Mario,"You guys do realize A lot of sonic fans are also Mario fans and want the movie to be good as well, right?",False,47,0,,,11,,47,,public
Mario,The True Fury,False,23,0,I took some time and effort to make an idea of combining super saiyan blue + blue penguin.,,0,,23,,public
Mario,anyone else have this as there wallpaper,False,19,0,,,9,,19,,public
Mario,We do people want this?!?!?!,False,28,0,,,15,,28,,public
Mario,they should've used his classic color scheme for the movie. it's the superior colors scheme,False,84,0,,,61,,84,,public
Mario,I feel bad for Chris Pratt due to how the internet has been treating him these last few days due to his Mario voice.,False,255,0,"Am I the only one who feels bad for Chris Pratt due to how the internet has been treating him ever since his Mario voice was shown? While I do agree that they did a better job with it in other countries, I also noticed that Chris Pratt seemed very excited about this job and there's a lot of memes and stuff about how he did a bad job when it was actually that they picked the wrong person for this job.",,160,,255,,public
Mario,Question about Petey Piranha.,False,5,0,"Hi

I have been looking around for Petey Piranha's character designer, I've looked at wikis but i haven't found anything, so i have resorted to asking here.

I really like Petey, so i would like to know who designed them for Mario sunshine, if anyone has an answer, please quote your source.

&amp;#x200B;

Thank you in advance, even if you just try.",,2,,5,,public
Mario,IT’S REAL!!!,False,40,0,,,0,,40,,public
Mario,FUN FACT GUYS,False,100,0,,,7,,100,zMario-Kart,public
Mario,Stop lying. None of you -- not one! -- can tell the difference.,False,180,0,,,65,,180,,public
Mario,The Mario Movie will run on Xbox and PlayStation but not on Nintendo Switch,False,66,0,,,10,,66,,public
Mario,Mario Ketchum (OC),False,6,0,,,1,,6,,public
Mario,I drew BOWSER today,False,6,0,I hope you guys enjoy! My style is a bit different and if it gets 100 rt I'll be drawing king k rool,,1,,6,,public
Mario,"Ay Lakituman, where's the fricking princess? (Art by @ScottForester17)",False,88,0,,,9,,88,,public
Mario,Not the first time Toad has had teeth.,False,43,0,,,0,,43,Yoshi,public
Mario,One of my biggest criticisms of Mario Odyssey was how lackluster and small-scale most of the levels felt. I'm really hoping that The Super Mario Bros. Movie inspires EPD to be more ambitious when it comes to level design for 3D Mario games.,False,30,0,,,19,,30,,public
Mario,Drawing every Super Smash Bros. Fighter in the style of The Mario and Luigi series. Day: 05 (OC),False,14,0,,,0,,14,,public
Mario,Chris Pratt,False,9,0,,,0,,9,,public
Mario,Jackser definitely gonna yield now.,False,4,0,,,0,,4,,public
Mario,"if people came to the minions sequel in full suits, then what should we dress as when we go see the super mario movie?",False,974,0,,,269,,974,,public
Mario,am I the only one who notices Chris Pratt puts on a new York accent in the Mario movie trailer?,False,31,0,Literally everyone says he changes nothing. I'm ready to debate that.,,15,,31,,public
Mario,Lego SMW Big Mario jumping,False,13,0,,,0,,13,,public
Mario,"Just saw the much awaited MaRRRio trailer, looks great ngl",False,45,0,,,1,,45,,public
Mario,koopa poopa,False,26,0,,,2,,26,,public
Mario,Who WOULD be an acceptable voice actor for Mario in the Mario movie? (If we play by Illuminations rules),False,6,0,"Alright, I have a question for everyone here. Lets assume that Illumination does NOT want to give Mario anything close to an italian accent, which includes anything like Charles Martinet, Lou Albano, or anything that would be even remotely Mario ish. Is Chris Pratt the best choice for Mario?   


Let's also consider that Luigi as Charlie Day is not the best pick for Luigi, but everyone seems to be significantly less mad about Luigi as Charlie Day than Chris Pratt as Mario. I feel that this is because Charlie Day somewhat matches the personality of Luigi, so, playing by Illuminations rules, Charlie Day is the best pick for Luigi.  


Thus, here is my question in full: Playing by Illuminations stipulations, which means no Italian in either of the Bros, who WOULD be the best voice actor for Mario? You are only allowed to pick relatively big name Celebrities, and it has to fit Mario better than Chris Pratts performance.",,7,,6,,public
Mario,These Guys must stop,False,4,0,,,0,,4,,public
Mario,Idk why but the bowser trailer felt like the rock trolls invasion of the techno kingdom,False,6,0,,,1,,6,,public
Mario,Story time: my experience seeing the live action Mario Movie in 1993,False,7,0,"So with us finally getting a trailer for the animated Mario movie, I thought I’d share my story about seeing the original Mario movie way back in 1993 when I was a young 12 year old.
Like most kids in the late 80s and early 90s, I loved Mario. I played all the games, watched the cartoons.  I got all 4 McDonalds SMB3 toys. You get the idea.  I read about the upcoming movie in a Nintendo Power Mario special magazine with the SMW guide. And that’s all I heard for a while.
I remember seeing promos and trailers and was like “huh? It’s live action and PG—13? Why doesn’t Luigi have a mustache?” CG wasn’t super common yet so I expected an animated movie in 1993. I was very confused.
So fast forward to the end of May. I was originally going to go to this DARE party at the local mall. As you know DARE was when you wasted an hour of school listening to a cop tell you “drugs are bad m’kay.”  I was originally interested in the party at the mall because I thought the big arcade would be open for this since it was by the food court where the party was. Nope. Just sitting in the food court with pizza and a DJ.  So I said “screw that” and my parents bought me a ticket to the Mario movie.  Probably a lateral move for me.   I remember the movie starts and you hear the Mario theme and that’s the closest it gets to anything resembling the games.  The entire movie experience was…confusing.  I kept expecting, I don’t know seeing something reminiscent of the games. I get why the Princess character was called Daisy (Peach was still Princess Toadstool).  Big Bertha the fish was a big black lady.  Iggy and Spike? Iggy is a Koopa kid but Spike was a regular enemy. Oh Yoshi looks ok. Hey and there’s a Bob Omb!!  Hey it’s Toad…and he’s gone.  Oh now they look like the bros.!
I walked out of the theater not sure what I saw.  
This was a tough time in my life. My grandmother was dying and my parents were divorcing so this was just another disappointment for me in 1993.

This is why I’m not bothered by Chris Pratt or Mario’s face being “off?”  I’ve seen worse. Instead I can take my daughter to this new movie and just have fun.

Thanks for listening",,2,,7,,public
Mario,The Super Mario Bros. Movie Experience Intruction Handbook,False,82,0,,,17,,82,zPeach,public
Mario,Is Bowser really a koopa?,False,7,0,"Bowser is the king of the koopas, yet he is clearly very different from every other koopa regarding appearance - which makes sense, he is the big bad guy and should stand out from the rest. It does make you wonder though, is the king of the koopas really a koopa if he that much different from the rest of the koopas?

At first I thought that Bowser started out as a regular koopa - after all he has yellow skin and a green shell on his back like other koopas, so perhaps he simply grew larger and larger while changing more and more. However, he has a son that looks just like him except smaller, indicating that Bowser likely never looked like regular koopa at all.

So what gives? Is there an in-game explanation for this? Is he a mutated koopa? Or is he a rare breed, a one-in a million type of Koopa? Something like Ganon in the legend of Zelda?",,11,,7,,public
Mario,Do you yield?,False,32,0,,,1,,32,,public
Mario,let's get Mario his Peach 🍑 back!,False,3,0,Just in case you feel bored and want to sign a petition. https://chng.it/QvgQdH2bzc  let's get Mario his Peach back.,,11,,3,,public
Mario,"Seriously, some people need to chill.",False,287,0,,,63,,287,zLuigi,public
Mario,This ad came out of nowhere (I already watched the Mario trailer 2 days ago…),False,11,0,,,3,,11,,public
Mario,Who loves/Likes Bowser?,False,15,0,"I mean I’m a fan of some Mario villans. Such as the Koopalings Ect.

Also Bower is being voiced by Jack black in the New Mario film in 2023!",,8,,15,,public
Mario,How Chris Pratt be sounding as Mario.,False,7,0,,,0,,7,,public
Mario,"The trailer, except everyone sounds normal(ish)",False,19,0,,,4,,19,,public
Mario,Sonic in r/Mario how do you like that?,False,5,0,,,9,,5,,public
Mario,my life is like a daisy,False,4,0,,,2,,4,,public
Mario,The Super Mario Bros Movie trailer but it looks like Mario 64,False,2756,0,,,37,,2756,,public
Mario,Made a little animation after seeing the new trailer,False,8,0,,,2,,8,,public
Mario,"You owe it to yourself. Zoom in on this high res version of the Super Mario Bros Movie poster, and get lost in the level of detail [3158 x 5000]",False,211,0,,,34,,211,,public
Mario,The best Mario! 👍 or 👎,False,492,0,,,64,,492,,public
Mario,"Mario movie design, before and after.",False,584,0,Tried to make him look more like himself. Is it better or worse? I’m not sure.,,177,,584,,public
Mario,The last thing Luigi sees,False,104,0,,,8,,104,,public
Mario,It's like that.,False,1,0,,,3,,1,,public
Mario,"I painted fanart, I’m excited for the movie! IG Vyntresser",False,28,0,,,2,,28,,public
Mario,Mario Movie Theory: Charles WILL voice Mario (kinda),False,5,0,"Everybody at this point has heard Chris Pratt's voice for *The Super Mario Bros. Movie*. While objectively it's much different than previous incarnations, I'm actually in the camp of those who don't mind the voice. I will not judge the voice entirely until I am in the theater on day one with my full attention. That being said Charles Martinet **is** Mario, and I think Nintendo and Illumination are aware of that. If you watch the trailer, the moment where Mario meets Toad, the voice is silent when he screams. Now it could mean that haven't found the right take from Pratt to insert, but it could be possible that Martinet might be dubbing over his screams. Now, I bet you're thinking that would jarring to hear two different people voicing Mario. And it would be, but this is how I think they will justify it. Seeing how this is an adaptation, the movie has an excuse to add or expand on elements we normally don't see in the games. That element I think they will focus on is Mario and Luigi's parents specifically their father. I believe there will be a sequence in the movie where Mario and Luigi are children talking to their father, who will look and sound exactly like Charles's Mario. When Mario gets older, Luigi will probably make a joke to him about ""having some of their father in him"", which is why Pratt's Mario will occasionally have Martinet coming out of him. I think if this was the case that would be a fun way to still honor Martinet. But it is a theory, so who knows, but regardless I'm pumped for this move. Thoughts?",,4,,5,,public
Mario,Should I get this tattoo?,False,55,0,,,7,,55,,public
Mario,Mario Penguins... but JOJO!,False,23,0,,,0,,23,,public
Mario,"I know Chris Pratt voicing Mario in his regular voice is not good but I think Illumination's trying to make this movie as good as possible, right?",False,114,0,,,43,,114,,public
Mario,"Marry, F**k, Kill. [VERY HARD]",False,8,0,,,7,,8,,public
Mario,Mario &amp; Luigi: Superstar Saga fanart!,False,51,0,,,4,,51,,public
Mario,It's always the bad guys,False,400,0,,,24,,400,,public
Mario,The BOWSER™ movie,False,247,0,,,6,,247,,public
Mario,Bowser at Mario when he kidnaps Peach for the 3794th time:,False,164,0,,,2,,164,,public
Mario,How the Mario movie will play out,False,37,0,,,5,,37,,public
Mario,"So, when will the next Movie Trailer happen?",False,5,0,"I'm personally thinking it'll happen at TGA's.  I dunno, just makes the most sense to me.  

[View Poll](https://www.reddit.com/poll/xzjhnb)",,7,,5,zLuigi,public
Mario,Don't forget Forman Spike is suppost to appear in the movie as well,False,11,0,,,4,,11,,public
