subreddit,title,clicked,ups,downs,post_paragraph,likes,number_of_comments,category,score,author_flair_css_class,subreddit_type
Mario,Super Mario Movie Trailer MEGATHREAD,False,385,0,"Want to discuss about the movie trailer? You're on the right place!

Be sure to follow the subreddit rules while commenting there!

You can watch the trailer here: https://www.youtube.com/watch?v=yPpazvJrHm0",,913,,385,,public
Mario,"Karma farming posts get removed, egregious reposts will go straight to ban",False,112,0,"First up, apologies for these out of date rules and their juvenile phrasing, that is on our agenda. That said, this post isn't a new rule - it's an existing one:

Rule 2: If a post has no purpose or is something that is incredibly similar/identical to a recent post, it will be removed.

Shitposts, jokes, memes and stuff in that area will continue to be allowed, put posts asking for upvotes, posts asking for others to repost it, and those knockout tournament things where you just repost the same image the next day but now something's been scribbled out all get removed.

Mario doesn't have deep lore, this is never going to turn into a serious discussion subreddit where we only allow quality indepth content. This subreddit is moderated, though we normally stick to a silent approach, but we'll probably give the sidebar and graphics a clean up in the new year. We will probably look for additional mods in the new year, too - at the moment I'm mostly happy with how we moderate, just not as happy with how quickly we do it.",,7,,112,,public
Mario,Do you think maybe he had no idea what he was getting into?,False,909,0,,,178,,909,,public
Mario,Mario from the Mario movie if he looked more like his design from the games,False,369,0,,,13,,369,,public
Mario,"Seeing as the Mario Bros. are from NYC/NDC in the movie, think the Wario Bros. being in the Mafia would be a fitting origin for them?",False,137,0,,,22,,137,,public
Mario,Who Would You Cast As Waluigi In A Possible Mario Movie Sequel?,False,107,0,,,111,,107,zWaluigi,public
Mario,"The trailer of ""The Super Mario Bros. Movie"", but it's a NES style Sprite Comic",False,126,0,,,11,,126,,public
Mario,I’m not familiar with all the Koopa variants. Is the eyepatch one on the right a recurring character? I think the scared one on the left is a hammer bro.,False,199,0,,,28,,199,,public
Mario,I love this Super Mario RPG artwork. This was originally made by a Twitter account named PaleaRaptor.,False,134,0,,,7,,134,,public
Mario,Mario discovers r34,False,616,0,,,29,,616,,public
Mario,Just a quick sketch of Luigi using his Lighting Powers (Art by me),False,19,0,,,2,,19,,public
Mario,What would happen if Mario never existed?,False,32,0,,,55,,32,,public
Mario,Epic leap of faith,False,42,0,,,2,,42,,public
Mario,"In case nobody did this already, today is Paper Mario: The Thousand Year Door’s 18th anniversary. What an excellent game.",False,17,0,,,0,,17,,public
Mario,Shower thought,False,88,0,,,16,,88,,public
Mario,I love tumbrl sometimes,False,59,0,,,1,,59,,public
Mario,One last meme about the Movie Discourse.,False,176,0,,,27,,176,zLuigi,public
Mario,Feels like I can take over the world,False,57,0,,,7,,57,,public
Mario,Who needs Plessie anyway?,False,73,0,,,4,,73,,public
Mario,Mario has a special announcement!,False,30,0,,,3,,30,,public
Mario,I Like Cheese too😏😏😏,False,11,0,,,0,,11,,public
Mario,Does anyone else prefer New Super Mario Bros Wii over New Super Mario Bros U or am I the only one?,False,23,0,,,19,,23,,public
Mario,I forgot how frustrating Super Mario Sunshine is,False,5,0,,,6,,5,,public
Mario,Only took me around 4 or 5 hours of nothing but hiding after hiding lol,False,8,0,,,2,,8,,public
Mario,Isn’t his name supposed to be WaLuigi?,False,139,0,,,10,,139,,public
Mario,This entire Mario Movie voice discourse went too far...,False,20,0,,,3,,20,,public
Mario,Do you think Mario has a canon?,False,5,0,"I see people argue over this and I get both sides and I have to say, I do think Mario has a canon even if it's not focused on. People say Mario has no canon because it's just games for children and the lore isn't deep, which is fair, but that doesn't mean there is no canon. Ever since I was a child, I assumed every Mario game is canon to each other, I honestly felt it was obvious and common sense. The games tend to reference other games in the series and I don't think they do that just as an Easter egg. And there's no reason to assume all the games are disconnected at all. I honestly think every Mario game (except Smash, Sonic and Mario, Paper Mario, and the hotel mario type games and the mario kart games you find at arcades and Mario maker 1 are non canon, maybe bs super mario usa as well). What do you think? I wanna know what more people have to say on the topic.",,3,,5,,public
Mario,It's just a movie,False,17,0,,,1,,17,,public
Mario,"Give Chris Pratt a fucking chance, he's not that bad",False,546,0,,,190,,546,,public
Mario,Mario Movie trailer but it's Persona 4,False,3,0,,,0,,3,,public
Mario,Repost cuz I think this meme is relevant again,False,6,0,,,3,,6,,public
Mario,found an old lego mario toy i had,False,8,0,dont mind the missing hands and such i was young by the time i got this. pretty sure this is a mario kart thing since i also found a very broken bike belonging to DK,,1,,8,,public
Mario,I made an extended version of the poster using AI art,False,14,0,I also added some characters. I guess that’s how DK is gonna look in the movie 😂,,8,,14,,public
Mario,Why has Luigi snapped? (wrong answers only),False,12,0,,,6,,12,,public
Mario,Here's my theory about what Charles Martinet will voice in the Mario movie.,False,45,0,"Since Charles was announced in the casting, and that no one is announced for the voices of Wario and Waluigi, it's Charles who will continue to do the voices of these two characters in the movie.  


Also, maybe Charles will also do some specific voices for Mario and Luigi... For example, if the bros burn themselves in the lava or fall into a pit.   


Do you think this is plausible?",,31,,45,,public
Mario,The few times Peach was depicted with a Toad-like mushroom cap,False,2,0,,,0,,2,,public
Mario,My attempt at some Princess Peach Fan art,False,27,0,,,1,,27,,public
Mario,ITS ARRIVED BABY,False,41,0,,,2,,41,zWario,public
Mario,Has there been any news of a new super Mario main entry game?,False,2,0,"Not a spin-off, a main entry like odyssey.",,2,,2,,public
Mario,How is Charlie Day's speaking Luigi voice gonna sound?,False,3,0,"

[View Poll](https://www.reddit.com/poll/y1ofxf)",,4,,3,,public
Mario,Incredible Method Acting: Chris Pratt Paid A Gigantic Turtle To Kidnap His Wife In Order To Prepare For The Role Of Mario,False,21,0,,,3,,21,zBlooper,public
Mario,Luigi's Mansion 3 Coloring Pages - Ghosts for Halloween,False,9,0,,,0,,9,,public
Mario,Does anybody have sny predictions for jokes they’re gonna tell in the mario movie?,False,7,0,"I feel like Mario’s gonnna reference Mario Kart or one of the sports games when he meets bowser, saying something along the lines of “Why can’t we just be buddies and go ride go-karts or play tennis?”",,5,,7,,public
Mario,"PSA to everyone, I'm tired of the discourse",False,905,0,,,88,,905,,public
Mario,OC - Kamek,False,1,0,"Not quite Hocus Pocus, but he’s kinda festive, right?",,0,,1,,public
Mario,How will the relationship between bowser and peach develop?,False,3,0,"that's a question that's been in my head for a while... the trailer for the film apparently shows that bowser's goal was to capture the star (and he succeeded) but in almost every game, even the most classic ones, his goal was to capture and marry the princess, so how will this develop in the film? will he still meet her throughout the movie?",,1,,3,,public
Mario,They’re just confirming everyone’s suspicions about the casting choices.,False,1,0,,,0,,1,zWaluigi,public
Mario,Uh oh.......,False,1,0,,,0,,1,,public
Mario,Mario Movie VOs,False,3,0,"Honestly, I'm loving Jack Black's voice for Bowser. So much energy and enthusiasm. As for Toad, I see potential. I like his voice and think he could be a fun character that will deliver some great comedy. 

But Mario...... I just don't know. It doesn't feel right. It feels so.... off. I'm a little unsure about him. I want to like him because I enjoyed Chris Pratt in other roles, but the voice just doesn't sit well to me.",,0,,3,,public
Mario,GUESS THE MARIO GAME WITH A SINGLE POWER UP,False,16,0,,,10,,16,,public
Mario,GTA San Andreas with Mario sounds,False,23,0,,,1,,23,,public
Mario,The Perfect Mario Couple Kiss😳😳,False,6,0,,,4,,6,,public
Mario,What “The Super Mario Bros” movie trailer didn't show us,False,47,0,,,2,,47,,public
Mario,The Wrong Princess? Beta Peach Doodle,False,44,0,,,0,,44,,public
Mario,I accidentally softlocked myself (Level: Valley of Bowser 1) (Game: Super Mario World),False,2,0,,,0,,2,zLuigi,public
Mario,Ah yes the Koopalings just as I remembered,False,195,0,,,7,,195,,public
Mario,Went to the mall the other day and saw these Super Galaxy Mario Sneakers.... I've never seen such a thing 👀 but I'm digging them low-key. Comment down what you think❗️,False,2,0,,,0,,2,,public
Mario,Some more doodles I did in class,False,14,0,,,1,,14,,public
Mario,GODDAMN BOWSER!,False,44,0,,,2,,44,,public
Mario,So where are Mario and Luigi from in the movie?,False,3,0,"So, since Mario doesn't recognize the Mushroom Kingdom in the trailer, where did he and Luigi come from? 

Is it gonna be New Donk City, Brooklyn, or something else entirely? 

My money is on New Donk because Toad's got buttons on his backpack showing off the Cascade and Sand Kingdom from Odyssey. 

I guess my only question is, if Mario's merely from another *country* and not another *world,* why hasn't he heard of the Mushroom Kingdom? Is the MK just an obscure, tiny little country that most people haven't heard of? Is Mario just bad at geography? This is the one thing that makes me wonder if he might end up being from another world after all.

What do you think?",,2,,3,,public
Mario,The fact that illumination misspelled goomba,False,107,0,,,14,,107,,public
Mario,"Say "" hello "" to Mario 🙂",False,6,0,I drew this when I was waiting the Mario's movie trailer ( I do Peach too ),,0,,6,,public
Mario,Weird question: do you think toad wears a diaper?,False,0,0,"I don't know why but this topic is currently wandering through my head as I do homework. My brother has been claiming this since he was 4 (he's 10 now). He says that other people think so too. (I'm assuming that by ""people,"" he means YouTubers he watches.)",,2,,0,,public
Mario,would King Boo be a good art teacher?,False,0,0,"He could show people how to paint, but most of his volunteers would never come back...",,0,,0,,public
Mario,With there being rumors that eventually there will be a Donkey Kong spin off film made by Illumination the same company who is also making The Super Mario Bros. Movie who do you think would be the perfect choice to voice King K. Rool if he was confirmed to be the film’s main villain?,False,203,0,,,117,,203,,public
Mario,Comparison of Mario,False,285,0,,,42,,285,,public
Mario,"Hear me out guys, Will Ferrell would be perfect as King K. Rool for the rumored Donkey Kong film!",False,5,0,,,3,,5,,public
Mario,This just might be true...,False,23,0,,,1,,23,,public
Mario,Star Power,False,32,0,,,5,,32,,public
Mario,Now Launched!✨Video game enamel pins in little pocket homes✨ Back now to get lower Early Bird prices for 1st 48 hours! Link in comments.,False,6,0,,,1,,6,,public
Mario,How do I get over this,False,255,0,,,73,,255,,public
Mario,Super Mario 64 in #picoCAD,False,450,0,,,11,,450,,public
Mario,daisy got some new kicks👟👟👟,False,128,0,,,16,,128,,public
Mario,so a Mario Movie Speedrun exists...,False,118,0,,,3,,118,,public
Mario,https://www.reddit.com/r/metalgearrising/comments/xzci7r/praying_nobody_beat_me_to_it/?utm_source=share&amp;utm_medium=ios_app&amp;utm_name=iossmf,False,0,0,Senator bowser,,0,,0,,public
Mario,Help finding Green Star in Mario Galaxy,False,3,0,I’m playing my first play through on Mario Galaxy. I’ve managed to collect 98 stars. I have two green stars (from Dusty Dune and Buoy Base) but where do I find the third one? Luigi is in the Hub and he is hinting me toward the Good egg Galaxy. But he never shows up there neither do I get any mails from Toad telling me that Luigi is stuck there. What to do?,,5,,3,,public
Mario,hot take: this is the second best mario kart game ever,False,68,0,,,21,,68,,public
Mario,my attempt of redesigning mario though...,False,128,0,,,8,,128,,public
Mario,where did mario go?,False,47,0,,,4,,47,,public
Mario,he's so sad :‚(,False,33,0,,,7,,33,,public
Mario,Luigi game,False,2,0,In the haunted mansion?,,3,,2,,public
Mario,5 stars super mario bros wii,False,1,0,i can’t get 5 stars on super mario bros wii. i have gotten all the star coins beat all the levels got every secret exit and used every cannon. suggestions please???,,0,,1,,public
Mario,This should be a Halloween 🎃 picture for Nintendo.,False,65,0,,,2,,65,,public
Mario,"Is Mario ""super"" because he's normally seen enhanced by a mushroom?",False,6,0,"Does this mean that his most vulnerable small form is his normal ""non-super"" state? If so does this mean he's actually a really small midget? Do the Mario brothers have some sort of physical condition? All the other human characters are taller than them. (I guess Wario doesn't follow conventional proportions either however)

Maybe it's because he's actually some sort of super human (that would make sense consider his feats). But then again the Mario movies suggests he came from the real world.",,6,,6,,public
Mario,we've only heard 1.5 seconds of it give Chris a chance,False,443,0,,,295,,443,,public
Mario,Shy Guy Keycap ‼️,False,37,0,,,0,,37,,public
Mario,The fact that illumination misspelled goomba,False,29,0,,,4,,29,,public
Mario,Pauline! - {Blender},False,31,0,,,2,,31,zPauline,public
Mario,Me when Mario movie:,False,114,0,,,5,,114,,public
Mario,I guess Miyamoto skipped the spelling lesson.,False,12,0,,,0,,12,,public
Mario,Wario vs Kirby Smash Bros Fanart (by me),False,31,0,,,2,,31,,public
Mario,Not again!,False,86,0,,,4,,86,,public
Mario,My guy went from being around the same size as Mario in the games to being smaller than a Koopa Troopa.,False,108,0,,,8,,108,zWaluigi,public
Mario,Yippy Yo Joe: The Movie,False,19,0,,,0,,19,,public
Mario,Worth buying and holding sealed?,False,7,0,Anyone purchased these trading cards and holding them as a collectors/investment piece. How do they stack up on long run against other collectables?,,2,,7,,public
Mario,Voicing Mario in the Super Mario Bros. Movie is an impossible task,False,2,0,,,1,,2,,public
Mario,"For those of you who don’t know, Bowser has ancestors who were Kings before him",False,16,0,,,2,,16,,public
Mario,They are two different scenarios. Why are people trying to compare them?,False,43,0,,,1,,43,,public
Mario,What do you think about shy guy showing up in the Mario movie?,False,7,0,"Shy guy is my favorite Mario universe character and it would be cool to see them

[View Poll](https://www.reddit.com/poll/y0z91q)",,2,,7,,public
Mario,Am I the only one that Just enjoys all the different Marios and each of their Voice interpretations?,False,14,0,"Maybe It’s just the internet having knee jerk reactions to 10 seconds of footage as usual, but I really don’t get why everyone is acting like the world is ending just cause Pratt’s Mario isn’t a pitch perfect replica of Charles. In my mind, I just like to think of all the different Marios as their own entity, and that there really isn’t a MAIN one.

Even though I love Charles to death and he’s done it the longest, I don’t think people should act like his voice is the only one that should ever be acknowledged. Super Show, CDI, Movie, and even the old OVA Mario are all valid, and deserve just as much respect as each other. He IS meant to be an Everyman, after all. He’s not locked down to one single version of himself.

(Also, may I remind you that Charles stated the doing the Mario voice for extending periods of time is legitimately painful for him. So doing that for a full movie would be awful. He’s not exactly young, after all.)",,1,,14,,public
Mario,The two types of video game mascots,False,117,0,(Still haven’t “perfected” drawing Mario lmao),,7,,117,,public
Mario,The Super Mario Bros Movie Poster Breakdown | Poster Design Review,False,5,0,"I think the majority of you had played this game, I hadn't, but I had seen gameplays multiple times... So let's talk about the new movie poster of The Super Mario Bro. Movie. Here I will try to explain what the poster is telling, it's all about poster design.

[The Super Mario Bros. official movie poster](https://preview.redd.it/m9xtczdum3t91.jpg?width=1200&amp;format=pjpg&amp;auto=webp&amp;s=e7bf06e0713ced863a8934e5b84d91cece4c277e)

A lot of movie posters like this, where we see the main character from the backside, and their world in front of them. This type of poster composition usually tells that this character is in the lead and he/she will explore the world, the adventure thing. And if you notice, the character in this poster is watching the castle at the top. This means one of the character's objectives in this movie will be to reach the castle, probably to save somebody, or if you know about this then let me know in comments about what is that castle about. This is the mushroom world, isn't it? Every design (characters and houses) is beautifully inspired by mushroom, which tells it's friendly and joyful, I mean it will have a lot of comedy.

If we talk about colors, supporting the soft corner design language, definitely falls somewhere in the kids' genre. Saturated-bright colors. And animation (render) style is photorealistic, a kind of Pixar or like Despicable Me. The studio which worked on this movie is Illumination, the one that gave us a character like minions from Despicable Me films. So, you can relate to which type of movie this will be.

The layout of the poster is a centered composition and which makes the two elements stand out (draws attention), the character at the bottom and the castle at the top, with the perfect silhouette.

What are your thoughts on this movie? Did you play this game?... Tell me more about your theory on villains and side characters.",,0,,5,,public
Mario,"If there are power ups in the movie, how do you think they will handle them? will Mario just touch a fire flower and gain the power, or he'll have to munch it down to gain their powers?",False,1003,0,,,128,,1003,,public
Mario,Princess Toadstool in my style! (Oba/Offbalance Art),False,29,0,,,15,,29,,public
Mario,Remember the hats that GameStop employees had to promote Mario Maker?,False,33,0,,,2,,33,,public
Mario,"Frog, yes or no (for mario odyssey)",False,22,0,,,5,,22,,public
Mario,Witch Rosalina flying around (art by me),False,7,0,,,0,,7,,public
Mario,My hope for The Super Mario Bros. Movie,False,3,0,"The trailer and the poster look convincing enough. They look like Illumination actually put in the work. More so than their past films. Here’s some hope that I have for the movie:

I hope the movie just looks downright beautiful. Nintendo is very good at making amazing visuals and background within their games. Super Mario Galaxy, Breath of the Wild, most stages in Super Smash Bros. Ultimate. I hope the Mario movie won’t be any different in terms of beauty. I also hope that they’ll have a good cinematic shots throughout the film. The shot of Bowser emerging his floating castle thing looks badass, and the part where he blew fire at the ice castle and it collapsed then turning to dust blowing to the screen while the Koopas cover their faces, *muah* that looked so cool. Luigi getting chased by the Dry Bones looks super decent as well. I hope that there’ll be more cool cinematic shots like those. Similar to Yoshi sitting on the bridge during a sunset in Super Mario 64 DS. 

I hope the voice acting remains good. We all laughed and made fun of the casting reveal a year ago, but now that we heard it, it was a lot better than we expected. Jack Black sounds awesome. I thought he was gonna be a comedic villain but no, he sounds much cooler. Chris Pratt remains debatable but understandable. In my opinion, he doesn’t sound that bad but he could’ve been better. We just need to hear more of his voice and then we’ll have true thoughts of it. I hope he actually tried though, please Chris Pratt, don’t mess this up. I was very impressed with Keegan Micheal-Key playing toad. He actually sounds so good as Toad, it generally surprised me. Anya Taylor-Joy is a very talented actress. I’m sure she’ll make a fine Peach. And Charlie Day as Luigi will be perfect. They unironically fit so well together. 


I hope the plot will be decent enough. I’m ok with the generic “Bowser kidnaps Peach” thing but I hope they add more stuff to it. The trailer makes it seem like Mario’s early days so I hope his background is cool. Since Foreman Spike, the man who’s been forgotten for decades, is showing up, I hope Pauline shows up too. It only makes sense because she played a big role in Mario’s early life. Please, for the love of god, don’t make this a musical! All the casts have singing experiences. If it is a musical, all that hope I have is erased completely. 

I hope more characters show up too. Charles Martinet as Wario would be amazing. But if not, I hope his “surprise cameos” will be like Stan Lee’s cameos in Marvel films. There’s also seem to have Daisy’s logo around the poster. That means Miyamoto acknowledges her existence. I don’t think she’ll show up in this particular movie but I hope she will in the sequels. Maybe a trope where Luigi falls in love as soon as he sees her face and slowly they start developing feelings for each other would be really nice. I hope Yoshi shows up as well.

I’ve seen many people on the internet talking about potentially starting the “Nintendo Cinematic Universe”. I don’t hate the idea, but they really really have to be careful in order for it to be successful. No doubt the Mario movie is going to be huge, and I’m sure it’ll be a massive success. But if they ever do consider officially making that a thing, I just hope they don’t mess it up. 

I also hope it’s not an advertisement either. That would truly truly suck. I hope they’ll add something nostalgic for us and hopefully the movie stick to the source. Which it already seems like it. I just hope the movie is good and becomes successful",,0,,3,,public
Mario,"Besides the Super Mushroom, Super Star or Fire Flower which powerup do you wanna see in the movie (Please be realistic)",False,40,0,,,92,,40,,public
Mario,Idk why but my brain told me to make this,False,43,0,,,3,,43,,public
Mario,I just finished making my nephew birthday present.,False,18,0,"Just like me and his dad, he loves everything Mario. Right now he is obsessed with Luigis Mansion and is going as Luigi for Halloween. I cannot wait to give this to him! I made it 100% from scratch.",,1,,18,,public
Mario,Mario movie 2 has to be a mario galaxy adaptation,False,4,0,Mario in space is just too easy,,7,,4,,public
Mario,Lego SMW Big Mario running,False,11,0,,,3,,11,,public
Mario,Where's my stored items in NSMB Deluxe Switch,False,2,0,Just got myself a switch and I'm playing a Mario game for the first time since 2006 aha. I remember when I used to play NSMB on DS i could stack items. So if I had a fire flower activated and picked up another it will be stored at the bottom of the screen so I could use it after losing that form. Is this still a thing on NSMB Deluxe since when I pickup items that I'm actively using it just gives xp?,,3,,2,,public
Mario,Leaked Princess Peach design for The Super Mario Bros Movie,False,57,0,,,28,,57,,public
Mario,"Super Mario 64, But AI Generated",False,21,0,,,3,,21,,public
Mario,"New Meme Template, have fun",False,14,0,,,1,,14,,public
Mario,Reoccurring dreams about SM64DS,False,4,0,I'm hearing more and more people having dreams about Super Mario 64. I thought I was the only one. I usually have dreams about the Nintendo DS version specifically though (I grew up with both). I have a constantly reoccurring dream where you play as Wario or Luigi inside this weird green swamp/sewer level. I also have dreams of the castle hub area being a lot larger as well. Y'all have similar dreams?,,2,,4,,public
Mario,Mario Family Tree,False,8,0,,,41,,8,zPeach,public
Mario,[Easter Egg] The store sign on the Antique's Store in the Super Mario Bros Movie poster might look familiar to the eagle-eyed. As it's written in the original SMB NES Title Screen font,False,34,0,,,4,,34,,public
Mario,MARIO MOVIE TRAILER!,False,6,0,,,0,,6,,public
Mario,Who would've thought the 64 Penguins would've been turned into their own monarchy?,False,270,0,,,42,,270,,public
Mario,"Someone in a thread joked that the Penguin Kingdom formed from the penguins that were thrown off the cliff in Super Mario 64, so I turned a trailer screenshot into a dystopia novel cover.",False,9,0,,,4,,9,,public
Mario,Question about the Mario Movie.,False,4,0,Did everyone expect Mario to have a Brooklyn accent or an Italian accent?,,4,,4,,public
Mario,[OC] the Koopa King,False,18,0,,,1,,18,zBlooper,public
Mario,Kings of Nintendo,False,10,0,,,1,,10,,public
Mario,I'm still thinking about the Mario Movie so I remade the Penguin scene but as an RPG to calm down,False,885,0,,,39,,885,,public
Mario,So the thumbnail for the 1993 movie on Netflix is... a little misleading,False,53,0,,,16,,53,,public
Mario,"I understand the disappointment of Charles Martinet not voicing Mario, but people really need to chill about Chris Pratt. Besides, we've only heard 2 lines so far.",False,658,0,,,175,,658,,public
