subreddit,title,clicked,ups,downs,post_paragraph,likes,number_of_comments,category,score,author_flair_css_class,subreddit_type
Mario,I think The Super Mario Bros. Movie has potential to be a good video game adaptation.,False,2,0,"Now don’t get me wrong, I don’t think it will be a cinematic masterpiece. But I believe this movie will pass off as being an enjoyable video game adaptation. And so far, it seems to be sticking with its source material. (example: the Mario 64 penguins)

Jack Black as Bowser is honestly wayyy better than I expected, and I honestly think Kevin Michael Richardson’s Kamek sounds pretty good as well. I was especially surprised with how Keegan Michael Key’s Toad voice sounded. I’d rather have that than the obnoxious screaming Toad voices from the games. The overall design for the movie itself looks absolutely gorgeous and the character designs look better than most of Illuminations animation styles.

Now let’s address the elephant in the room… Chris Pratts Mario voice. 

Now this might be a little controversial… but honestly, i’m fine with it. Obviously it’s not my ideal casting choice for Mario, Far from it actually. I always thought Danny Devito would be good for the role. He’s actually Italian and him and Charlie Day have great chemistry. But as far as Chris’s voice acting goes, it sounds fine. i’ve kinda just gotten used to it. 

Now the internet is acting like him voicing Mario is a death sentence. Obviously everyone is entitled to their own opinions, but I say give him a chance. He only said like 2 lines chill out. 🤣🤣

Overall, what are your guy’s thoughts on the Mario Movie? Does it look promising?",,3,,2,,public
Mario,what do you think of Chris pratt as Mario?,False,4,0,,,7,,4,,public
Mario,"Alright here me out, what if we get something like this for the post credit scene in the movie.",False,6,0,,,2,,6,zMario-Kart,public
Mario,It just happened so I'm not sure if its going to be an upopular opinion but that intro went hard man!,False,140,0,,,7,,140,,public
Mario,The movie poster is looking pretty good,False,192,0,,,0,,192,,public
Mario,“This will make a great meme template ” Request fulfilled.,False,82,0,,,1,,82,,public
Mario,Mario face in Pilotwings 64?!,False,3,0,,,0,,3,,public
Mario,Honestly not a bad Mario rendering for the movie,False,132,0,,,14,,132,,public
Mario,How would you caption toad face?,False,18,0,,,3,,18,,public
Mario,Jack Black's gonna have some extreme back pains from carrying this movie.,False,99,0,,,4,,99,,public
Mario,Am I the only one who doesn’t mind Pratt’s voice. It kinda reminds me of Lou Albano’s Brooklyn accent in a way.,False,24,0,,,13,,24,,public
Mario,So here's this,False,22,0,,,1,,22,,public
Mario,My thoughts on the teaser trailer,False,5,0," Omg the trailer was freaking awesome. The animation is beautiful. I'm even more excited for the movie after watching the teaser trailer. I freaking knew that Jack Black as Bowser wasn't going to disappoint. Jack Black killed the Bowser roll. I'm dying of excitement. Keegan Michael Key as Toad was great too, He makes Toad act so cute. Charlie Day as Luigi was great too. I need to hear more of Chirs Pratt as Mario to be able to judge better. I wanted to cry tears of joy when the first scene was played. Am I he only one that thinks Mario's model is kinda weird?",,0,,5,,public
Mario,"McDonald's really can't keep a secret, huh?",False,262,0,,,11,,262,,public
Mario,"I can't understand the people who say that this just sounds like Chris Pratt, he's clearly putting on a voice",False,96,0,,,27,,96,Cappy,public
Mario,"the trailer was so good, but this bug me",False,76,0,,,3,,76,,public
Mario,Chris Pratt working hard with the voice coach,False,10,0,,,0,,10,,public
Mario,Don't mind me just giving my final prayer before the trailer is released,False,181,0,,,6,,181,zShy-Guy,public
Mario,Am I the only one who saw this lol,False,113,0,,,12,,113,,public
Mario,A Super Mario World Headcanon Theory on why the Cave People are so dumb,False,1,0,"I don't really believe it and I was really bored and had too much free time, but it's something that I made as a headcanon just to make the Super Mario World cartoon better. The cavepeople have been continously  shown to be hopelessly dumb yet they still have a civilization and have been living there before Mario, Luigi, and the princess even came there as a vacation. It makes no sense that they are still alive at this rate when there are dinosaurs, Cave Caterpillars, and other types of danger. Luigi even had to teach them to crop and stuff.

What if there is something that is making them dumber than usual? In ""Mama Luigi"" Luigi reveals to Yoshi on how he found him and in said flashback, when they got there, the whole place was deserted. Koopa football players grabbed the princess, Mario has been attacked by a Koopa wizard, and he came face to face with a fire sumo. The reason why this happened, was because the cave people were absent. King Koopa was already there with his minions and waiting for them to come to Dome City in Dinosaur World. He could be responsible of the cave people's IQ drop just to make it easier to control the land and give Mario a hard time.

Further proof and explanations:

**Wizardheimer:** He is the most powerful koopa wizard, wether he worked for King Koopa or not, he may have something to do with it with his evil magic. In ""***Rock TV***"" it showed brainwashing magic is a thing.

**The Dino Riders:** They are smart enough to be a gang and ride motorcycles. The broken english is common language for the residents of the Dinosaur World. They are  outsiders of Dome City, so chances are only the residents of Dome City had been affected.

**Harmful berries:** It's possible that they encountered some berries that potentially damaged their brains, they used to be smarter but those berries affected them. Those red berries seen in ""***Gopher Bash***"" are quite common. They are now less aware of their sorroundings and their judgement has been impaired. Mario, Luigi, the Princess are not aware of this and they are sometimes affected by them but since they don't regularly eat them, the effects are reversible. That's why in ***""Ghost R Us""*** They were too careless to jump into the  warp pipe when they could just run from Wizardheimer in an open forest. 

In a ***""little Learning"":*** Not enough is shown of them, but the cave people are noticeably more rational and have a school. They also went along with the Princess' suggestion to make the Koopa Kids good and it seemed it was going to work had Oogtar not intervened. (They were only antagonistic to Oogtar and occasionally Yoshi who was with bad influence Oogtar.  Oogtar is still an unlikeable brat. Lol.",,0,,1,,public
Mario,"I don't know if something's wrong with me or not, but I actually am perfectly fine with toad having teeth.",False,4,0,"&amp;#x200B;

https://preview.redd.it/dqu9sct17es91.jpg?width=276&amp;format=pjpg&amp;auto=webp&amp;s=809fef641a39a81d384766a5743528e079d2ba5a",,0,,4,,public
Mario,Super Mario Bros Movie first scene without context,False,97,0,,,2,,97,,public
Mario,My partner just showed me this : This reminds me of Mario from the trailer!,False,4,0,,,1,,4,,public
Mario,Yo imagine if this actually happened- (Random mid effort meme),False,39,0,,,0,,39,,public
Mario,Even though Chris Pratt is good this could be more interesting,False,0,0,,,0,,0,,public
Mario,Replace Chris Pratt with Danny Devito in the upcoming Mario movie. Check Comments,False,1,0,,,1,,1,,public
Mario,What do you guys think about Luigi's movie design ?,False,4,0,,,5,,4,zDaisy,public
Mario,"I know, I’m really original",False,77,0,,,4,,77,,public
Mario,Let the movie memes begin,False,81,0,,,1,,81,,public
Mario,"Ladies &amp; Gentlemen, Mario &amp; Sonic Fans Alike! In Perfect Timing, I Present To You All: The Official Un-Official 3rd Mario &amp; Sonic Movie Poster...Now Known As ""Mario &amp; Sonic At The Movies!""",False,94,0,,,12,,94,zDaisy,public
Mario,"To celebrate the trailer, pleae enjoy this crappy edit I did of Movie Mario in his classic outfit",False,147,0,,,19,,147,zLuigi,public
Mario,"If the Mario Movie had a post credit scene with a new character, who would it be?",False,3,0,"Add body text

[View Poll](https://www.reddit.com/poll/xy145i)",,5,,3,zMario-Kart,public
Mario,Does anyone else feel like the difficulty spike in Mario+Rabbids is too big?,False,2,0,"When I first played the game, it was pretty smooth sailing (but what do you expect from world 1?) Then we get to world 2. It was nice difficulty increase. Not hard, but not to easy.

And then we get to the mid boss...

Bruh...what was with the random jump in difficulty? It actually took me over 10 tries to beat Sandy and Blizzy. 

And that was when the game decided to stop playing around, because so many battles after that were just really hard. Especially this specific one in world 4. Like, I know it's the final world, but who in their right thought it was a good idea to have to go through FOUR BATTLES IN A ROW without losing???

And the bosses. OMG. Not counting world 1, the only boss I didn't struggle with was the world 3 mid boss. Every other one was actual hell. As in it took me a few days to beat them hell. 

And this game is supposed to be rated E10+. How do you expect a 10-12 year old to beat some of these battles? It's ridiculous. 

But this is just me. What do you guys think?",,1,,2,,public
Mario,Bowser GigaChad,False,10,0,,,2,,10,,public
Mario,Opinions on the face?,False,81,0,Looks good to me,,48,,81,,public
Mario,what if they chose Marc Graue to voice mario in the new mario movie,False,1,0,i chose him because he the olny guy that voice mario that still alive,,1,,1,,public
Mario,Do you yield? (VOLUME WARNING),False,49,0,,,1,,49,,public
Mario,"So who do you think will take the roll of ""minons"" in the movie?",False,3,0,"

[View Poll](https://www.reddit.com/poll/xy0oxg)",,10,,3,,public
Mario,Who would have made a better Mario voice?,False,1,0,"To all the Mario fans out there who watched the trailer for the movie and though Chris Pratt sucked ass (like me). I understand that maybe listening to Charles Martinet’s Mario voice for two hours straight might be jarring to some people, so if you could’ve picked another celebrity to voice Mario instead of Chris Pratt and Charles Martinet, who would you pick? Personally I would have gone with Tom Hanks. His voice feels more like Mario’s and he did a pretty good job with Toy Story (plus, he was originally cast as Mario for the 1993 movie before Bob Hoskins, so as a bonus it would be full circle for him). Also, he would’ve attracted just as much at the box office if not more since he is a bigger star than Pratt. 

Any thoughts? Does anyone else have anyone in mind that couldve been better than Pratt?",,3,,1,,public
Mario,What would be your ideal way to handle Mario’s voice in the movie?,False,3,0,"I know a lot of people find it weird hearing Chris Pratt’s normal speaking voice coming from Mario who is typically more energetic. I agree that it sounds really odd. 

However I think they may have known this when trying to cast Mario. I love Martinet’s voice but his lines are usually to provide some feedback to the player performing certain action. Do we really want to hear that voice for an hour and a half straight?

I’m really torn about the voice. How do you think it should have been handled?",,6,,3,,public
Mario,A thought: maybe Mario's voice woulda been more welcomed and accepted if we got to hear him say something more... iconic instead of generic,False,59,0,,,3,,59,,public
Mario,They go through so much pain.,False,20,0,,,0,,20,,public
Mario,Any clue what this means? Was browsing Twitter and got the notification. There's others in the likes too.,False,4,0,,,2,,4,,public
Mario,Illumination Logo!!,False,1,0,"I was thinking about how every illumination film has some sort of opening joke in their logo, so I’m wondering what the joke in the Mario movie will be!",,1,,1,,public
Mario,@lifershop on Instagram making HEAT,False,0,0,,,0,,0,,public
Mario,Kamek the Magikoopa chain pin,False,3,0,"
Kamek the Magikoopa chain pin

Releasing today at 12pm PST/3pm EST

Follow @pinny_hardaway &amp; @cappaveil on Insta

https://pinnyhardaway.com

https://cappaveil.com/collections/all",,1,,3,,public
Mario,how would you react if they hired marc graue to voice mario in the new mario movie,False,1,0,i would have pic the other but they all dead,,0,,1,,public
Mario,I mean he looks cool,False,5,0,,,0,,5,,public
Mario,Happy Mario Movie Trailer Day,False,4,0,,,0,,4,,public
Mario,jack black boswer sounds simmilar to scoot burns boswer,False,1,0,dont@ me,,0,,1,,public
Mario,The super mushroom is real!!!,False,41,0,,,4,,41,,public
Mario,why do I have to go back with yoshi every time I game over on this shine,False,1,0,,,0,,1,,public
Mario,Waht have I done,False,95,0,,,3,,95,,public
Mario,Pengen (Mario Movie Trailer) (I’m sorry this is really stupid),False,13,0,,,2,,13,,public
Mario,My internal compass is non existent,False,54,0,,,0,,54,,public
Mario,Bruhbruhbruh,False,6,0,,,0,,6,,public
Mario,Incredible Mario dress by @lifershop,False,1,0,,,0,,1,,public
Mario,So Waluigi's age is... 26%...?,False,16,0,,,4,,16,,public
Mario,I love the way dry bones look ; am I the only one?,False,14,0,,,3,,14,zDry-Bones,public
Mario,"Can you have a ""Cartoon character falls through portal into a new world"" scene with out the shoulder rub &amp; rotate move followed by the slow look around?",False,3,0,,,0,,3,,public
Mario,Is there still a chance he could appear in the movie or should I just give up hoping,False,5,0,,,7,,5,,public
Mario,about the movie,False,1,0,"Most of the actors are fine, Jack Black is at least trying, but they gave top billing to Chris Pratt, who just plays *himself* in every movie; they gave the role to an *actor* who...*doesn't act. Ironically,* Nintendo and illumination are relying *TOO HEAVILY* on ""star power.""",,0,,1,,public
Mario,Same Energy,False,27,0,,,1,,27,zLuigi,public
Mario,Jack Black as Bowser is perfect.,False,61,0,I love Jack Black as Bowser! He sounds just like I'd imagine him to sound like! Opinions?,,4,,61,,public
Mario,Thoughts on the Mario Movie trailer?,False,6,0,"I loved it. Only thing that isn't great was the voice for Mario.

[View Poll](https://www.reddit.com/poll/xxu7n9)",,4,,6,,public
Mario,Is Toad's Mushroom a Hat?,False,59,0,,,17,,59,,public
Mario,Can’t have a movie without someone getting utterly destroyed!,False,59,0,,,2,,59,Yoshi,public
Mario,The Super Mario Bros movie trailer summed up in 1 image,False,45,0,,,2,,45,,public
Mario,"Now sure does seem like a good time to announce a new Mario Game for this Spring, Nintendo",False,3,0,"I just want to watch this movie in theaters, than go home and play Odyssey 2. Do it Nintendo. 


I'm a chump. 

Take my money.",,1,,3,,public
Mario,The original Mario animated movie,False,5,0,,,1,,5,,public
Mario,Nobody can stop him,False,23,0,,,3,,23,,public
Mario,The title.,False,237,0,,,29,,237,,public
Mario,What do you guys think of Chris Pratt's mario voice so far?,False,3,0,"mario movie voting

[View Poll](https://www.reddit.com/poll/xxxqcy)",,5,,3,,public
Mario,MARIO MOVIE OFFICAL TRAILER LET'S GOOOOOO,False,52,0,,,2,,52,zLuigi,public
Mario,"In the coming months: I predict that Chris Pratt will receive a decent amount of criticism for his voice of Mario, &amp; then Charles Martinet will randomly Tweet out how much he likes Chris Pratt’s take on the character.",False,9,0,And then people will settle down and not be so harsh about it.,,3,,9,,public
Mario,HERE WE GOOOOOOOOOO-,False,796,0,,,80,,796,,public
Mario,"Nintendo better not let Chris Pratt get away with not saying Mario's famous, ""Let's-a-go!"" or, ""It's-a-me, Mario!"" or something along those lines.",False,2,0,"&amp;#x200B;

https://preview.redd.it/9jkww2l65es91.jpg?width=275&amp;format=pjpg&amp;auto=webp&amp;s=61f9f09aba99d9db3a88d6d7eecaf54cd7f83362",,1,,2,,public
Mario,Whenever Miyamoto talks about “his good friend Chris-san”:,False,27,0,,,0,,27,,public
Mario,"None of you probably asked for this, but here is a comparison with both Mario and Sonic’s movie designs",False,41,0,,,8,,41,zMario-Kart,public
Mario,Overreacting About Mario’s Voice,False,11,0,"You’ve heard like, five seconds of Chris’ Mario voice and immediately write it off.
Give it a chance. He’s doing an obvious Brooklyn accent, I don’t know how people can’t hear it.",,20,,11,,public
Mario,"So the whole ""Chris Pratt does his normal voice for Mario"" joke... that's not a joke anymore, huh?",False,42,0,,,2,,42,,public
Mario,Calling it now (Mario voice),False,0,0,"The voice we heard is Mario's voice at the beginning of the movie. 

As time goes on, something will happen and Mario will sound more like what people were expecting. 

**MARK MY WORDS**",,0,,0,,public
Mario,Chris Pratt gets morbed,False,0,0,,,12,,0,,public
Mario,#bringbackhisass,False,11,0,I’m just disappointed in this animation choice. Why can’t this gorgeous movie showcase the dumptruck we all know Chris Pratt deserves.,,1,,11,,public
Mario,mario's gonna get hit by truck-kun :(,False,5,0,,,1,,5,zRosalina,public
Mario,I like how they brought back the laces deatil from Luigi's Mansion for the Mario movie,False,36,0,,,2,,36,,public
Mario,what do you think about marios new voice?,False,3,0,"What do you people think about marios new voice. Personally I was not a big fan but it is actually growing on me already.

[View Poll](https://www.reddit.com/poll/xxweqp)",,0,,3,,public
Mario,Leaked Mario Movie Ending. Another One Comming Soon,False,29,0,,,1,,29,,public
Mario,MARIO FROM TRAILER!,False,49,0,,,3,,49,,public
Mario,Bowser is gonna be so cold 🥶,False,4,0,,,2,,4,,public
Mario,Anyone think this looks like a McDonald’s straw?,False,19,0,,,2,,19,,public
Mario,me and my friend's Mario Movie BINGO (made in October 2021 but I'm pretty sure it's still accurate),False,78,0,,,14,,78,,public
Mario,"Guys, Chris Pratt's voice is not that bad. It isn't faithful granted, but he doesn't look Italian in the movie. His voice works good for his new design. Mario barely spoke over 30 Lines in 30 Years so doing an Italian voice for atleast 2 hours would be hard. Pratt is as big a fan as us remember.",False,38,0,,,61,,38,,public
Mario,I think we may of found a meme template here boys,False,42,0,,,1,,42,,public
Mario,Super Mario Xenobros: Fun Crossover Idea,False,6,0,,,1,,6,,public
Mario,I COULDENT BE THE ONLY ONE THAT THOUGH THIS,False,40,0,,,3,,40,,public
Mario,“That is but a taste of our fury! Do you yield?”,False,12,0,,,1,,12,,public
Mario,Thoughts on the trailer?,False,38,0,,,57,,38,,public
Mario,My only art suggestion tip for the movie. Better mushroom kingdom backdrops.,False,9,0,,,5,,9,,public
Mario,This will be one of the movies of all time,False,109,0,,,1,,109,,public
Mario,Both Super Sonic in Sonic the Hedgehog 2 AND Mario’s front design for The Super Mario Bros. Movie!,False,14,0,,,0,,14,,public
Mario,What Mario music you'd want to hear in the movie?,False,4,0,"It was mentioned that Koji Kondo-san is involved with the music. Personally, I'd love to hear the New SMB Wii Airship theme as I feel that song fits well into a movie atmosphere.",,2,,4,,public
Mario,Let’s a go,False,42,0,,,0,,42,,public
Mario,Mario board games,False,1,0,"I’m wondering how many original (physical/irl) board games based on the Mario series exist or have existed and what they are. Have they been documented?

(Original, not a Mario version of a game)",,4,,1,,public
Mario,Do you YIELD?,False,11,0,,,1,,11,,public
Mario,I guess if he only played the 2D stuff he never heard him speak,False,20,0,,,4,,20,,public
Mario,Has anyone else seen the storyline for the super mario movie on IMDB.,False,207,0,,,38,,207,,public
Mario,For the new trailer. Characters I’ve been meaning to put in my style for a while now anyway.,False,31,0,,,3,,31,,public
Mario,"""I just-a hope I'm-a not too late!""",False,33,0,,,2,,33,,public
Mario,The smirk on this Glacial King 😼,False,20,0,,,0,,20,,public
Mario,Mario movie poster but it's Hotel Mario,False,298,0,,,18,,298,,public
Mario,I made a meme format out of a still from the trailer,False,12,0,,,0,,12,,public
Mario,Anyone still remember Mario Warfare?,False,14,0,,,3,,14,,public
Mario,Mario kart koopas.,False,1,0,"&amp;#x200B;

https://preview.redd.it/y2b4wg1r8es91.png?width=482&amp;format=png&amp;auto=webp&amp;s=a8f1c62d854ec0998f37f811b9a2a8a327a4c606

https://preview.redd.it/0vmwzs2r8es91.png?width=720&amp;format=png&amp;auto=webp&amp;s=8b4849b62bd2dfad118ddd36801aa056bbdd2616",,0,,1,,public
Mario,It's kinda weird to me that the international dubs managed to make Mario sound more like Mario than the original.,False,10,0,,,5,,10,,public
Mario,That one penguin is really angry lol,False,18,0,,,2,,18,,public
Mario,DON'T TOUCH THAT MUSHROOM YOU'LL DIE!!!!!!!,False,24,0,,,0,,24,,public
Mario,Quality intentional (mario movie meme),False,8,0,,,0,,8,,public
Mario,I’m so glad we’re getting Brooklyn accent Mario,False,13,0,It’s been so long after the Mario bros super show and the adventures Super Mario bros 3.,,15,,13,,public
Mario,Movie Mario With Game Accurate Proportions,False,14,0,,,7,,14,,public
Mario,Brought my Mario to school yesterday,False,4,0,,,0,,4,,public
Mario,"""It's-a Me, Mario!""",False,47,0,,,2,,47,,public
Mario,When I look at Mario's face in the trailer I cannot unsee Gene from Wreck It Ralph,False,12,0,,,0,,12,,public
Mario,me when the:,False,20,0,,,0,,20,zToad,public
Mario,I redrew Mario’s movie redesign as a way to celebrate the trailer’s release,False,12,0,,,0,,12,,public
Mario,It's a me. Mario.,False,7,0,,,0,,7,,public
Mario,Man Bowser looks great. Illumination did a great job with his design and Jack Black's voice works pretty well for him (imho),False,22,0,,,1,,22,,public
Mario,Do You Yield?,False,8,0,,,1,,8,,public
Mario,It’s a Me A Mario,False,6,0,,,1,,6,,public
Mario,Mario is smexy! Look at that nose!,False,4,0,,,0,,4,,public
Mario,For anyone who says Chris Pratt didn’t change his voice AT ALL,False,11,0,,,4,,11,,public
Mario,Chris Pratt and Charlie Day are nothing compared to these guys.,False,7,0,,,0,,7,,public
Mario,Keegan Michael Key as toad sounds a lot better than I was expecting!,False,8,0,"I was hoping he would utilize some of that crackly gravelly Ness in his voice for toad, and sure enough he does. They also seem to of pitched it up slightly which I think definitely helps.",,8,,8,zPeach,public
Mario,To celebrate the release of the teaser here's the one made for the 1993 movie!,False,19,0,,,5,,19,,public
Mario,All Right! The Mario Movie Title Was Revealed! LETS-A-GO!,False,13,0,,,1,,13,,public
Mario,"I ask that you please place your pitchforks down. I loved literally everything else, but I can't lie about this:",False,6,0,,,1,,6,,public
Mario,I literally just got a flashback,False,18,0,,,0,,18,,public
Mario,Pablo's been living the good life.,False,18,0,,,0,,18,zDaisy,public
Mario,Might be a stretch but the pipe Mario comes out have has a similar look to Brooklyn Architecture,False,16,0,,,8,,16,,public
Mario,"Wasn't too satisfied with the normal movie logo, so I tried my own twist on it. A bit more faithful to the original source material",False,7,0,,,1,,7,,public
Mario,in roll the meme formats,False,19,0,,,5,,19,,public
Mario,Someone like Robert DeNiro should have played Mario,False,1,0,Chris Pratt sounds off. We need a New Yorker voice like Bob Hoskins and the tv show Mario.,,0,,1,,public
Mario,I absolutely love this design! My Favourite Mario Character mixed with Charlie Day looks phenomenal!!! All the designs look fantastic! I never thought i'd say this but... Illumination you did a absolutely AMAZING job!,False,17,0,,,0,,17,,public
Mario,"Mario from memory, by me, the hype is on the sky!",False,6,0,,,2,,6,,public
Mario,"my favorite part of the trailer was when bowser said ""it's over mario, you've mamma'd your last mia""",False,16,0,,,2,,16,,public
Mario,Props for Jack Black,False,16,0,"I know Chris Pratt's awful performance is gonna be the talk of the town for a bit, but I gotta say that Jack Black really did well with Bowser. I love the guy, he's a fantastic performer, but I wasn't expecting much out of this one. He still nailed it! That part's cool even if the rest is gonna probably be a dumpster fire.",,0,,16,,public
Mario,How to redeem Chris Pratt as Mario.,False,3,0,"Contrary to popular opinion, I don’t hate the Chris Pratt Mario voice. Was he a great first choice for a generational video game icon like Mario? Probably not. 

That being said, from the two lines we received in the trailer, I didn’t necessarily hate his voice. I think this interpretation of Mario will be different from the video game counterparts, obviously because it’s a film, not a game. From the voice that we heard so far from Chris, I think they’re going for more of a “Super Mario Bros Super Show” callback. It honestly makes sense, as Mario is more so a Brooklyn Italian than an Italian Italian. I love Charles Martinet's version of Mario, as I grew up on it. We should keep in mind, though, whether his voice would work for a feature film. The only lines he’s ever delivered for Mario are one-liners or noises when he physically moves. We don’t know how this voice would translate into lines and how well they could be acted in their original form. 

I think a good last-minute solution to this, unless they’ve already included it, is adding Charles Martinet's voice dubs over specific actions. Mario jumping, for example, then going back to Chris Pratt. It would be both funny and satisfy certain fans. 

That said, I still think Chris Pratt was a weird choice for Mario. I don’t think it should be as overanalyzed as it has been since we have literally only received two lines.

Jack Black as Bowser is excellent, by the way.",,3,,3,,public
